,id,title,name,abstract,year,title_use,abstract_mentions_count,doi,url
233,234,Community Resources For Older Adults With Chronic Illness.,"weierbach,fm","Elders with chronic diseases frequently have problems with activities of daily living and instrumental activities of daily living. This article describes a holistic, elder-friendly community model. The review of the nursing, healthcare, and social science literature offers insight into the complexity of community resources for elders.",2009,0,1,10.1097/HNP.0b013e3181bf37bd,http://www.systems.wsu.edu/scripts/wsuall.pl?url=https://search.ebscohost.com/login.aspx?direct=true&db=ccm&AN=105247227&site=ehost-live
106,107,Experiential Service Learning: Building Skills And Sensitivity With Kolb'S Learning Theory.,"long,elizabeth.m","Preparing a healthcare workforce able to respond to the growing complexity of health issues facing older adults is a critical issue for interprofessional educators. Students are in need of experiences promoting confidence and skill in communicating with older adults with cognitive issues. Student emotional and cognitive responses to an interprofessional Music and Memory® project in long term care facilities were evaluated. Forty-eight students met with assigned adults weekly to develop personalized music playlists and complete a journal entry. Student participants demonstrated improved interpersonal connections, enhanced professional skills, and increased empathy toward clients. Results are explored within the context of Kolb's Learning Theory and application of the evaluation outcomes for interprofessional education.",2020,0,1,10.1080/02701960.2019.1673386,http://www.systems.wsu.edu/scripts/wsuall.pl?url=https://search.ebscohost.com/login.aspx?direct=true&db=ccm&AN=143139207&site=ehost-live
213,214,Frailty And Geography: Should These Two Factors Be Added To The Abcde Contemporary Guide To Diabetes Therapy?,"maddaloni,ernesto","On the road towards personalized treatments for type 2 diabetes, we suggest here that two parameters could be added to the ABCDE algorithm, 'F' for frailty and 'G' for geography. Indeed, the progressive ageing of population is causing a simultaneous increase of frailty worldwide. The identification of the optimal therapeutic approach is often difficult in frail subjects because of the complexity of 'frailty syndrome'. Nevertheless, given the relevance of diabetes in the development and progression of frailty, a safe and effective cure of diabetes is extremely important to guarantee a good medical outcome. There are few data about diabetes treatment in this delicate category of patients, and the choice of the appropriate therapy mostly remains a challenge. Moreover, type 2 diabetes affects more than 382 million people of different countries, races and ethnicities. To face the lack of solid evidence-based medicine for the treatment of diabetes in different ethnic groups, it is extremely important to increase knowledge about the different pathophysiology of diabetes according to ethnicity. In this way, a tailored approach to treatment of various ethnic groups living in the same or different regions can eventually be developed. Copyright © 2016 John Wiley & Sons, Ltd.",2016,0,1,10.1002/dmrr.2762,http://www.systems.wsu.edu/scripts/wsuall.pl?url=https://search.ebscohost.com/login.aspx?direct=true&db=ccm&AN=112999189&site=ehost-live
214,215,Regulation Of Cardiac Autonomic Nervous System Control Across Frailty Statuses: A Systematic Review.,"parvaneh,saman","Background: Frailty is a geriatric syndrome that leads to impairment in interrelated physiological systems and progressive homeostatic dysregulation in physiological systems.Objective: The focus of the present systematic review was to study the association between the activity of the cardiac autonomic nervous system (ANS) and frailty.Methods: A systematic literature search was conducted in multiple databases: PubMed/MEDLINE, Embase, Cochrane Library, Web of Science, CINAHL, and ClinicalTrials.gov; the last search was performed in March 2015. Inclusion criteria were: (1) that the studied population was classified for frailty according to a standard definition, such as Fried's criteria; (2) that the study had a nonfrail control group, and (3) that heart rate (HR) and/or heart rate variability (HRV) were parameters of interest in the study.Results: Of the 1,544 articles screened, 54 were selected for full-text review and 6 studies met the inclusion criteria. Assessment of HRV using different standard time domain, frequency domain, and nonlinear domain approaches confirmed the presence of an impaired cardiac ANS function in frail compared to nonfrail participants. Furthermore, HR changes while performing a clinical test (e.g., the seated step test or the lying-to-standing orthostatic test) were decreased in the frail group compared to the nonfrail group.Conclusions: The current systematic review provides evidence that the cardiac ANS is impaired in frail compared to nonfrail older adults, as indicated by a reduction in the complexity of HR dynamics, reduced HRV, and reduced HR changes in response to daily activities. Four out of 6 included articles recruited only female participants, and in the other 2 articles the effect of gender on impairment of cardiac ANS was insufficiently investigated. Therefore, further studies are required to study the association between cardiac ANS impairments and frailty in males. Furthermore, HRV was studied only during static postures such as sitting, or without considering the level of activity as a potential confounder. Accordingly, simultaneous measurement of both physiological (i.e., HRV) and kinematic (e.g., using wearable sensor technology) information may provide a better understanding of cardiac ANS impairments with frailty while controlling for activity.",2015,0,1,10.1159/000431285,http://www.systems.wsu.edu/scripts/wsuall.pl?url=https://search.ebscohost.com/login.aspx?direct=true&db=ccm&AN=111505582&site=ehost-live
64,65,Caring For Older Patients At An Emergency Department -- Emergency Nurses' Reasoning.,"kihlgren,al","AIM: The aim of the study was to use the experiences of emergency nurses to illuminate what constitutes good nursing care for patients 75 years or older transferred to emergency departments. BACKGROUND: Emergency departments have a medical technical character and the number of visits there increases dramatically as people age. Older patients require increased healthcare services in terms of nursing care, interventions and hospitalizations due to an increased complexity of their problems. For these reasons it is important to study what good nursing care of the older patients consists of at an emergency department from the emergency nurses' point of view. METHOD: Ten emergency nurses from a university hospital emergency department in Sweden were interviewed. A thematic content analysis was performed. RESULTS: The study showed that it was necessary to be knowledgeable, to be understanding of the older patients' situation and to take responsibility for them in order to be able to provide good nursing care. The emergency nurses shifted focus from describing the central aspect of good nursing care to describing what hinders the provision of it. Their experience was that prioritizing medical procedures, everyday tasks and routines threatens good nursing care of older patients in emergency departments. The emergency nurses held that the older patient is often sent to an emergency department where the level of care is not appropriate to their needs. CONCLUSIONS: The result can be seen as a challenge for the organization and the nurses in the future; to prioritize differently, thereby maintaining a balance between good nursing and medical/technical tasks when treating older patients. RELEVANCE TO CLINICAL PRACTICE: The present day healthcare system is not organized to appropriately meet the needs of the older patients. Nurses themselves hold they can better serve the older patient. By sharing their experiences, both can be accomplished.",2005,0,1,10.1111/j.1365-2702.2004.01104.x,http://www.systems.wsu.edu/scripts/wsuall.pl?url=https://search.ebscohost.com/login.aspx?direct=true&db=ccm&AN=106504830&site=ehost-live
216,217,Transforming Emergency Services For Frail Older People In Hospital.,"thompson,deborah","Managers of emergency care, acute medicine and geriatric medicine care had a difficult few months over winter managing rising demand for emergency care, and the likelihood is that we will face similar demands in future winters unless we improve services and release capacity. The complexity of this demand is also changing with more frail older people presenting for emergency care. With this in mind, there is an urgent need to improve and streamline emergency services to meet the needs of this patient group. This article focuses on the principles that managers can employ to improve frailty services and the processes that can be adopted to develop effective frailty services in hospitals that deliver better outcomes for patients.",2015,0,1,10.7748/nm.22.3.18.s29,http://www.systems.wsu.edu/scripts/wsuall.pl?url=https://search.ebscohost.com/login.aspx?direct=true&db=ccm&AN=103805934&site=ehost-live
217,218,How Older People Cope With Frailty Within The Context Of Transition Care In Australia: Implications For Improving Service Delivery.,"walker,ruth","Transition care is increasingly common for older people, yet little is known about the subjective experience of the transition care 'journey' from the perspective of clients themselves. This study examines how older people cope with frailty within the context of a dedicated transition care programme and discusses implications for improving service delivery. Qualitative in-depth interviews were carried out during 2011 in the homes of 20 older people who had recently been discharged from a transition care programme operating in Adelaide, South Australia (average age 80 years, 65% female). Thematic analysis identified three key themes: 'a new definition of recovery', 'complexities of control' and 'the disempowering system'. Despite describing many positive aspects of the programme, including meeting personal milestones and a renewed sense of independence, participants recognised that they were unlikely to regain their previous level of functioning. For some, this was exacerbated by lacking control over the transition care process while adapting to their new level of frailty. Overall, this research highlighted that benefits associated with transition care can be undermined by fragmentation in service delivery, loss of control and uncertainties around future support.",2015,0,1,10.1111/hsc.12142,http://www.systems.wsu.edu/scripts/wsuall.pl?url=https://search.ebscohost.com/login.aspx?direct=true&db=ccm&AN=103748438&site=ehost-live
218,219,Can Routine Preoperative Data Predict Adverse Outcomes In The Elderly? Development And Validation Of A Simple Risk Model Incorporating A Chart-Derived Frailty Score.,"amrock,levana.g","Background: Frailty has emerged as an important predictor of operative risk among elderly surgical patients. However, the complexity of prospective frailty scores has limited their widespread use. Our goal was to develop two frailty-based surgical risk models using only routine preoperative data. Our hypothesis was that these models could easily integrate into an electronic medical record to predict 30-day morbidity and mortality.Study Design: American College of Surgeons NSQIP Participant Use Data Files from 2005 to 2010 were reviewed, and patients 65 years and older who underwent elective lower gastrointestinal surgery were identified. Two multivariate logistic regression models were constructed and internally cross-validated. The first included simple functional data, a comorbidity index based on the Charlson Comorbidity Index, demographics, BMI, and laboratory data (ie, albumin <3.4 g/dL, hematocrit <35%, and creatinine >2 mg/dL). The second model contained only parameters that can directly autopopulate from an electronic medical record (ie, demographics, laboratory data, BMI, and American Society of Anesthesiologists score). To assess diagnostic accuracy, receiver operating characteristic curves were constructed.Results: There were 76,106 patients who met criteria for inclusion. Thirty-day mortality was seen in 2,853 patients or 3.7% of the study population and 18,436 patients (24.2%) experienced a major complication. The c-statistic of the first expanded model was 0.813 for mortality and 0.629 for morbidity. The second simplified model had a c-statistic of 0.795 for mortality and 0.621 for morbidity. Both models were well calibrated per the Hosmer-Lemeshow test.Conclusions: Our work demonstrates that routine preoperative data can approximate frailty and predict geriatric-specific surgical risk. The models' predicative powers were comparable with that of established prospective frailty scores. Our calculator could be used as a low-cost simple screen for high-risk individuals who might require additional evaluation or specialized services.",2014,0,1,10.1016/j.jamcollsurg.2014.04.018,http://www.systems.wsu.edu/scripts/wsuall.pl?url=https://search.ebscohost.com/login.aspx?direct=true&db=ccm&AN=103894031&site=ehost-live
219,220,Management Of Common Postoperative Complications: Delirium.,"javedan,houman",Delirium is a common postoperative surgical complication associated with poor outcomes. The complexity of delirium demands that each patient be assessed individually and a tailored prevention and treatment regimen be put in place. Nonpharmacologic and pharmacologic strategies are available to achieve this goal.,2014,0,1,10.1016/j.cger.2014.01.015,http://www.systems.wsu.edu/scripts/wsuall.pl?url=https://search.ebscohost.com/login.aspx?direct=true&db=ccm&AN=107793978&site=ehost-live
220,221,Obesity And Physical Frailty In Older Adults: A Scoping Review Of Lifestyle Intervention Trials.,"porter,starr.kathryn.n","Abstract: Many frail older adults are thin, weak, and undernourished; this component of frailty remains a critical concern in the geriatric field. However, there is also strong evidence that excessive adiposity contributes to frailty by reducing the ability of older adults to perform physical activities and increasing metabolic instability. Our scoping review explores the impact of being obese on physical frailty in older adults by summarizing the state of the science for both clinical markers of physical function and biomarkers for potential underlying causes of obesity-related decline. We used the 5-stage methodological framework of Arksey and O'Malley to conduct a scoping review of randomized trials of weight loss and/or exercise interventions for obesity (body mass index ≥ 30 kg/m2) in older adults (aged >60 years), examining the outcomes of inflammation, oxidative stress, and lipid accumulation in muscle, as well as direct measures of physical function. Our initial search yielded 212 articles; exclusion of cross-sectional and observational studies, cell culture and animal studies, disease-specific interventions, and articles published before 2001 led to a final result of 21 articles. Findings of these trials included the following major points. The literature consistently confirmed benefits of lifestyle interventions to physical function assessed at the clinical level. Generally speaking, weight loss alone produced a greater effect than exercise alone, and the best outcomes were achieved with a combination of weight loss and exercise, especially exercise programs that combined aerobic, resistance, and flexibility training. Weight loss interventions tended to reduce markers of inflammation and/or oxidative damage when more robust weight reduction was achieved and maintained over time, whereas exercise did not change markers of inflammation. However, participation in a chronic exercise program did reduce the oxidative stress induced by an acute bout of exercise. Weight loss interventions consistently reduced lipid accumulation in the muscle; however, in response to exercise, 3 studies showed an increase and 2 a decrease in muscle lipid infiltration. In summary, this scoping review identified strong clinical evidence that weight reduction and/or exercise interventions can improve physical function and biomarkers of physical dysfunction among overweight/obese older adults, supporting the suggestion that excessive adiposity contributes to physical frailty. However, the evidence also suggests a complexity of metabolic influences, both systemically and within muscle, which has not been elucidated to date. Considerable further study is needed to examine the mechanisms by which lifestyle interventions influence physical frailty before the net impact of such interventions can be fully understood.",2014,0,1,10.1016/j.jamda.2013.11.008,http://www.systems.wsu.edu/scripts/wsuall.pl?url=https://search.ebscohost.com/login.aspx?direct=true&db=ccm&AN=104054845&site=ehost-live
221,222,Wading In The Water: A Case Study Approach To Engaging More Fully In The Patient Narrative.,"tadel,patrice.m","Working in the patient narrative has become a familiar part of the common language used in the context of caring for patients. Working in the patient narrative encompasses sharing conversation that allows exploration of the entire patient experience as it relates to health and illness. However, the complexity of engaging in end-of-life conversations, standing steady with conflict, remaining present, maintaining neutrality, and actively listening remain challenging concepts in practice even though they are integral to effectively doing so. Literature review has identified and defined key elements of interactions that can lead to significant opportunities to ""wander more fully"" in the patient narrative. Two case studies reviewed therein demonstrate ways in which palliative care encounters and end-of-life discussions afford the interdisciplinary team members purposeful engagement with patients. One case discusses taking risks to delve more deeply into patient's fears related to dying. This exploration lays the foundation for assuring goals of care are aligned with individual patient values. The other case demonstrates the use of symbols to share dialog related to an individual's tasks of dying. When directed, intentional facilitation occurs, the patient's unique holistic needs and values are identified, and goals of care can be clarified. In conclusion, highlights of research and clinical applications provide advantageous practice implications.",2014,0,1,10.2190/IL.22.1.c,http://www.systems.wsu.edu/scripts/wsuall.pl?url=https://search.ebscohost.com/login.aspx?direct=true&db=ccm&AN=94450827&site=ehost-live
222,223,Aging And The Decision To Live Alone.,"murray,tracey","The complexities associated with aging challenge advanced practice registered nurses (APRNs) to ensure that each patient receives an individualized evaluation. Determining whether the patient should remain in an independent or alternative living environment must be based on respect for the individual's right to self-determination and on the evidence, including assessment of biological, social, and cognitive resources. This determination also must be communicated in a clear and appropriate manner to the patient and family. This article describes the nature of this decision, appropriate assessment strategies, and legal considerations for the APRN who works with elderly patients and their families.",2013,0,1,10.1016/j.nurpra.2013.05.018,http://www.systems.wsu.edu/scripts/wsuall.pl?url=https://search.ebscohost.com/login.aspx?direct=true&db=ccm&AN=107934601&site=ehost-live
223,224,Self-Reported Aging-Related Fatigue: A Concept Description And Its Relevance To Physical Therapist Practice.,"egerton,thorlene","Fatigue is one of the most common symptoms experienced by older people, both with and without chronic disease. It is unpleasant and distressing and can affect functioning and quality of life. Fatigue also may inhibit an older person from participating optimally in a physical therapy program aimed at rehabilitation or the promotion of better health. However, confusion surrounds the concept of self-reported aging-related fatigue, not only because of the complexity of the problem itself but also because of lack of clarity of definition and the use of the term 'fatigue' to describe a range of different concepts. This article aims to provide clarification of the concept in the context of physical therapist clinical practice. The intention is to increase awareness of the issue among physical therapists, promoting their assessment and consideration of the problem when planning health interventions involving functioning, physical activity, and exercise for older people.",2013,0,1,10.2522/ptj.20130011,http://www.systems.wsu.edu/scripts/wsuall.pl?url=https://search.ebscohost.com/login.aspx?direct=true&db=ccm&AN=104234806&site=ehost-live
224,225,Advances In Critical Care For The Older Patient.,"monkhouse,diane","As the proportion of elderly people in the general population increases, so does the number admitted to critical care. In caring for an older patient, the intensivist has to balance the complexities of an acute illness, pre-existing co-morbidities and patient preference for life-sustaining treatment with the chances of survival, quality of life after critical illness and rationing of expensive, limited resources. This remains one of the most challenging areas of critical care practice.",2013,0,1,10.1017/S0959259812000226,http://www.systems.wsu.edu/scripts/wsuall.pl?url=https://search.ebscohost.com/login.aspx?direct=true&db=ccm&AN=103909261&site=ehost-live
225,226,2012 – That Was The Year That Was.,"o'neill,desmond","Geriatric medicine has an encyclopaedic sweep, reflecting the complexity of both the ageing process and of our patient group. Keeping up with, and making sense of, the relevant scientific literature is challenging, especially as ageing has increased in prominence as a focus of research across many branches of the sciences and the humanities. This review of research published in 2012 in generalist, geriatric medicine and gerontology journals has been compiled with a view to extracting those aspects of research into ageing which could be considered relevant not only to the practice of geriatric medicine, but also to our understanding of the ageing process and the relationship of geriatric medicine to other medical specialties and public health. The research discussed includes new insights into global ageing and the compression of morbidity; nosological, clinical and therapeutic aspects of dementia; an innovative study on the microbiome and ageing; epidemiological perspectives into multi-morbidity; an overview of the impact of the first waves of Baby Boomers; fresh thinking on geriatric syndromes such as orthostatic hypotension, kyphosis, urinary incontinence after stroke, frailty and elder abuse; an update of the Beers criteria and the first stirrings of recognition of the longevity dividend in the biomedical literature.",2013,0,1,10.1093/ageing/afs201,http://www.systems.wsu.edu/scripts/wsuall.pl?url=https://search.ebscohost.com/login.aspx?direct=true&db=ccm&AN=85655713&site=ehost-live
63,64,An Exploration Of The Decision-Making Processes At The Point Of Referral To An Admiral Nurse Team.,"burton,j","The Admiral Nursing Service supports individuals caring for people with dementia. As a response to the high demand for one team's service, a temporary closure to referrals was agreed. This provided the impetus to explore the influence of nurses' decision making at the point of referral on demand for the service. The research questions addressed were: How do Admiral Nurses make decisions regarding referrals and What factors influence this decision-making process? Sixteen case studies were retrospectively reviewed through the auspices of a semi-structured interview aimed at identifying which factors influenced the nurses' acceptance or rejection of these referrals. Results indicated that the Admiral Nurses had a clearly identified focus in supporting the carers of people with dementia, but that the complexity of the carers situation which included the person with dementia was significant. However, the desire to fulfil a case-management role while attempting to provide a service that is of a specialist nature and of limited capacity generated tensions. The decision to offer a service to carers was consequently influenced not only by perceived need but also upon the nurses feeling professionally responsible for perceived gaps in service provision.",2005,0,1,10.1111/j.1365-2850.2005.00847.x,http://www.systems.wsu.edu/scripts/wsuall.pl?url=https://search.ebscohost.com/login.aspx?direct=true&db=ccm&AN=106502500&site=ehost-live
