,id,title,name,abstract,year,title_use,abstract_mentions_count,doi,url
146,147,Shift Work To Balance Everyday Life - A Salutogenic Nursing Perspective In Home Help Service In Sweden.,"agosti,madelaine.törnquist","Background. Nurses in Sweden have a high absence due to illness and many retire before the age of sixty. Factors at work as well as in private life may contribute to health problems. To maintain a healthy work–force there is a need for actions on work-life balance in a salutogenic perspective. The aim of this study was to explore perceptions of resources in everyday life to balance work and private life among nurses in home help service. Methods. Thirteen semi-structured individual interviews and two focus group interviews were conducted with home help service nurses in Sweden. A qualitative content analysis was used for the analyses. Result. In the analyses, six themes of perceptions of recourses in everyday life emerged; (i) Reflecting on life. (ii) Being healthy and taking care of yourself. (iii) Having a meaningful job and a supportive work climate. (iv) Working shifts and part time. (v) Having a family and a supporting network. (vi) Making your home your castle. Conclusions. The result points out the complexity of work-life balance and support that the need for nurses to balance everyday life differs during different phases and transitions in life. In this salutogenic study, the result differs from studies with a pathogenic approach. Shift work and part time work were seen as two resources that contributed to flexibility and a prerequisite to work-life balance. To have time and energy for both private life and work was seen as essential. To reflect on and discuss life gave inner strength to set boundaries and to prioritize both in private life and in work life. Managers in nursing contexts have a great challenge to maintain and strengthen resources which enhance the work-life balance and health of nurses. Salutogenic research is needed to gain an understanding of resources that enhance work-life balance and health in nursing contexts.",2015,0,1,10.1186/s12912-014-0054-6,http://www.systems.wsu.edu/scripts/wsuall.pl?url=https://search.ebscohost.com/login.aspx?direct=true&db=ccm&AN=103759461&site=ehost-live
91,92,Non-Equilibrium Systems Theory: Some Applications For Gerontological Nursing Practice.,"porter,ej","In terms of NEST, aging can be understood as a process of formative change toward increasing disorder and order in form, pattern, or structure. The person moves toward greater complexity through self-organization processes. Over time, self-organization processes result in increasingly unique perceptions and behavior. As an older person becomes more unique, he or she becomes more different from other older persons. Self-organization processes are an appropriate focus of concern for nursing when NEST is used as a practice framework. The nurse tries to understand older persons' behaviors as outcomes of self-organization processes (attempts to bring order out of disorder).",1995,0,1,,http://www.systems.wsu.edu/scripts/wsuall.pl?url=https://search.ebscohost.com/login.aspx?direct=true&db=ccm&AN=107418671&site=ehost-live
90,91,Handle With Care: Considerations And Approaches To Nursing The Frail Older Person.,"dennehy,ma","As society ages, a challenge is presented to health care providers. The increased population of frail older persons, those over 85 years of age, poses a complexity of needs and concerns. The registered nurse is often called upon to be the coordinator of the team of health professionals striving to meet the needs of frail older patients. This article examines implications for the nursing care of the frail older person, using the nursing process. It also examines and considers interdisciplinary rehabilitative interventions appropriate for this population. Case studies are used to compare and contrast approaches for frail older persons in the home and in institutional settings.",1995,0,1,,http://www.systems.wsu.edu/scripts/wsuall.pl?url=https://search.ebscohost.com/login.aspx?direct=true&db=ccm&AN=107367538&site=ehost-live
138,139,Improving Hip Fracture Outcomes With Integrated Orthogeriatric Care: A Comparison Between Two Accepted Orthogeriatric Models.,"middleton,mark","Background: our orthopaedic trauma unit serves a large elderly population, admitting 400-500 hip fractures annually. A higher than expected mortality was detected amongst these patients, prompting a change in the hip fracture pathway. The aim of this study was to assess the impact of a change in orthogeriatric provision on hip fracture outcomes and care quality indicators. Patients and Methods: the hip fracture pathway was changed from a geriatric consultation service to a completely integrated service on a dedicated orthogeriatric ward. A total of 1,894 consecutive patients with hip fractures treated in the 2 years before and after this intervention were analysed. Results: despite an increase in case complexity, the intervention resulted in a significant reduction in mean length of stay from 27.5 to 21 days (P < 0.001), a significant reduction in mean time to surgery from 41.8 to 27.2 h (P < 0.001) and a significant 22% reduction in 30-day mortality (13.2-10.3%, P = 0.04). After controlling for the effects of age, gender, American Society of Anesthesiology (ASA) Grade and abbreviated mental test score (AMTS), the effect of integrating orthogeriatric services into the hip fracture pathway significantly reduced the risk of mortality (odds ratio 0.68, P = 0.03). Conclusions: changing our hip fracture service from a geriatric consultation model of care to an integrated orthogeriatric model significantly improved mortality and performance indicators. This is the first study to directly compare two accepted models of orthogeriatric care in the same hospital.",2017,0,1,10.1093/ageing/afw232,http://www.systems.wsu.edu/scripts/wsuall.pl?url=https://search.ebscohost.com/login.aspx?direct=true&db=ccm&AN=122739162&site=ehost-live
139,140,"Symptom Trajectory And Symptom Burden In Older People With Multimorbidity, Secondary Outcome From The Rct Age- Fit Study.","eckerblad,jeanette","Aim The aim of this study was to follow the symptom trajectory of community-dwelling older people with multimorbidity and to explore the effect on symptom burden from an ambulatory geriatric care unit, based on comprehensive geriatric assessment. Background Older community-dwelling people with multimorbidity suffer from a high symptom burden with a wide range of co-occurring symptoms often resulting to decreased health-related quality of life. There is a need to move from a single-disease model and address the complexity of older people living with multimorbidity. Design Secondary outcome data from the randomized controlled Ambulatory Geriatric Assessment Frailty Intervention Trial ( AGe- FIT). Methods Symptom trajectory of 31 symptoms was assessed with the Memorial Symptom Assessment Scale. Data from 247 participants were assessments at baseline, 12 and 24 months, 2011-2013. Participants in the intervention group received care from an ambulatory geriatric care unit based on comprehensive geriatric assessment in addition to usual care. Results Symptom prevalence and symptom burden were high and stayed high over time. Pain was the symptom with the highest prevalence and burden. Over the 2-year period 68-81% of the participants reported pain. Other highly prevalent and persistent symptoms were dry mouth, lack of energy and numbness/tingling in the hands/feet, affecting 38-59% of participants. No differences were found between the intervention and control group regarding prevalence, burden or trajectory of symptoms. Conclusions Older community-dwelling people with multimorbidity had a persistent high burden of symptoms. Receiving advanced interdisciplinary care at an ambulatory geriatric unit did not significantly reduce the prevalence or the burden of symptoms.",2016,0,1,10.1111/jan.13032,http://www.systems.wsu.edu/scripts/wsuall.pl?url=https://search.ebscohost.com/login.aspx?direct=true&db=ccm&AN=118584366&site=ehost-live
89,90,The Effects Of Language Used By Caregivers On Agitation In Residents With Dementia.,"hart,bd","IN THIS STUDY, WE addressed the problem of whether residents with a diagnosis of dementia would become agitated if given verbal commands at a level of language complexity above their comprehension ability. The study used an A-B-A research design. The convenience sample of 15 subjects was comprised of 11 men and 4 women who resided in a long-term care institution. Their mean age was 86.6 years, and their average length of stay in the institution was 317.3 days. The results lent support to the hypothesis that exposing residents with dementia to language beyond their comprehension ability could result in agitated behavior. The predominant manifestations of agitation were general restlessness, strange noises, and negativism. An important implication for nursing practice is that the language used by caregivers should match the comprehension ability of residents. Caregiving can thereby facilitate communication and, potentially, prevent agitation.",1997,0,1,,http://www.systems.wsu.edu/scripts/wsuall.pl?url=https://search.ebscohost.com/login.aspx?direct=true&db=ccm&AN=107320155&site=ehost-live
141,142,Communicative Challenges In The Home Care Of Older Persons - A Qualitative Exploration.,"sundler,annelie.j","Aim To explore communicative challenges in encounters between nurse assistants and older persons during home care visits. Background The older population is increasing worldwide. Currently, there is a shift in care for older people from institutional care to home care. Providing home care in a person's home involves several challenges, including the complexity of communication. Design A descriptive observational design with a qualitative approach was used. Methods The data consisted of audio recordings of real-life encounters during home care visits between nurse assistants and older persons, collected in 2014. A hermeneutic phenomenological analysis was conducted. Results Communicative challenges were identified: (a) in situations where the older persons had a different view than the nurse assistants on the care task and its content; and (b) when unexpected actions or turns occurred in the communication. Challenges included older person's existential issues, fragility and worries and concerns, which often appeared to be only vaguely expressed and difficult to verbally detect and tackle. This engendered a risk of misinterpretation or ignorance of these challenges. Conclusion The findings point to the importance of communication as the key to facilitate person-centred home care. Communication training should focus more on addressing needs and existential issues in older persons. Person-centred home care for older persons needs to be addressed at both an individual and an organizational level.",2016,0,1,10.1111/jan.12996,http://www.systems.wsu.edu/scripts/wsuall.pl?url=https://search.ebscohost.com/login.aspx?direct=true&db=ccm&AN=117924132&site=ehost-live
142,143,Defining Safety In The Nursing Home Setting: Implications For Future Research.,"simmons,sandra.f","Currently, the Agency for Healthcare Research and Quality (AHRQ) Common Format for nursing homes (NHs) accommodates voluntary reporting for 4 adverse events: falls with injury, pressure ulcers, medication errors, and infections. In 2015, AHRQ funded a technical brief to describe the state of the science related to safety in the NH setting to inform a research agenda. Thirty-six recent systematic reviews evaluated NH safety-related interventions to address these 4 adverse events and reported mostly mixed evidence about effective approaches to ameliorate them. Furthermore, these 4 events are likely inadequate to capture safety issues that are unique to the NH setting and encompass other domains related to residents' quality of care and quality of life. Future research needs include expanding our definition of safety in the NH setting, which differs considerably from that of hospitals, to include contributing factors to adverse events as well as more resident-centered care measures. Second, future research should reflect more rigorous implementation science to include objective measures of care processes related to adverse events, intervention fidelity, and staffing resources for intervention implementation to inform broader uptake of efficacious interventions. Weaknesses in implementation contribute to the current inconclusive and mixed evidence base as well as remaining questions about what outcomes are even achievable in the NH setting, given the complexity of most resident populations. Also related to implementation, future research should determine the effects of specific staffing models on care processes related to safety outcomes. Last, future efforts should explore the potential for safety issues in other care settings for older adults, most notably dementia care within assisted living.",2016,0,1,10.1016/j.jamda.2016.03.005,http://www.systems.wsu.edu/scripts/wsuall.pl?url=https://search.ebscohost.com/login.aspx?direct=true&db=ccm&AN=116142604&site=ehost-live
88,89,Current Trends In The Clinical Management Of An Old Enemy: Congestive Heart Failure In The Elderly.,"stanley,m","Much has been learned in the past decade, through quality medical and nursing research, regarding the pathophysiology and management of congestive heart failure. Primary care practitioners are challenged to apply the latest data to the clinical management of these patients when there is clear evidence of improvement in the control of symptoms and quality of life. Because of the complexities of the disease process, older adults with congestive heart failure require a comprehensive approach that is particularly well suited to the knowledge and skills of the advanced practice nurse.",1997,0,1,,http://www.systems.wsu.edu/scripts/wsuall.pl?url=https://search.ebscohost.com/login.aspx?direct=true&db=ccm&AN=107238722&site=ehost-live
144,145,Impact Of A Collaborative Interprofessional Learning Experience Upon Medical And Social Work Students In Geriatric Health Care.,"gould,paul.robert","Interprofessional collaborative practice is increasingly recognized as an essential model in health care. This study lends preliminary support to the notion that medical students (including residents) and social work students develop a broader understanding of one another's roles and contributions to enhancing community-dwelling geriatric patients' health, and develop a more thorough understanding of the inherent complexities and unique aspects of geriatric health care. Wilcoxon Signed Rank Tests of participants' scores on the Index of Interdisciplinary Collaboration (IIC) indicated the training made significant changes to the students' perception of interprofessional collaboration. Qualitative analysis of participants' statements illustrated (1) benefits of the IPE experience, including complementary roles in holistic interventions; and (2) challenges to collaboration. The findings suggest that interprofessional educational experiences have a positive impact upon students' learning and strategies for enhanced care of geriatric patients.",2015,0,1,10.3109/13561820.2014.962128,http://www.systems.wsu.edu/scripts/wsuall.pl?url=https://search.ebscohost.com/login.aspx?direct=true&db=ccm&AN=109831129&site=ehost-live
87,88,Gn Management. Nurse To Nurse: Consultation In Geriatric Nursing Practice.,"smith,m","The complexity of clients in today's health care environment requires a close, collaborative working relationship among disciplines. However, nurses, who are often key decision-makers in the planning, management, and movement of clients throughout the health care system, may not use the expertise of their best allies: nurses in other settings, institutions, and specialty areas. Many care problems-at home or in the hospital, nursing home, or rehabilitation center-can be effectively resolved by nurse-to-nurse consultation. The importance and benefit of nurses relying on their own profession to answer nursing care questions are illustrated with vignettes that apply a model of consultation to the practice of geriatric nursing.",1998,0,1,,http://www.systems.wsu.edu/scripts/wsuall.pl?url=https://search.ebscohost.com/login.aspx?direct=true&db=ccm&AN=107261758&site=ehost-live
86,87,Differentiated Nursing Assessment Of Depressive Symptoms In Community-Dwelling Elders.,"onega,ll","Because of the complexity in assessing elders for depressive symptoms, we recommend that nurses use a differentiated approach as an adjunct to clinical judgment and other assessment strategies. Based on our research and clinical experience, we advocate the joint use of the Hamilton Rating Scale for Depression and the Dementia Mood Assessment Scale, and propose a two-tiered assessment process. The first differentiation in this process is made by means of a cut-off score to determine whether or not depressive symptoms exist. If depressive symptoms are present, a second system of differentiation may be employed to identify discrete symptom factors. Application of this differentiated approach will enable the nurse to better understand and design interventions for each elder's specific presentation of depressive symptoms. Copyright (c) 1998 by W.B. Saunders Company",1998,0,1,,http://www.systems.wsu.edu/scripts/wsuall.pl?url=https://search.ebscohost.com/login.aspx?direct=true&db=ccm&AN=107295072&site=ehost-live
160,161,Potentially Avoidable Hospitalizations Of Dually Eligible Medicare And Medicaid Beneficiaries From Nursing Facility And Home- And Community-Based Services Waiver Programs.,"walsh,edith.g","Objectives Beneficiaries dually eligible for Medicare and Medicaid are of increasing interest because of their clinical complexity and high costs. The objective of this study was to examine the incidence, costs, and factors associated with potentially avoidable hospitalizations ( PAH) in this population. Design Retrospective study of hospitalizations. Setting Hospitalizations from nursing facilities ( NF) including Medicare and Medicaid-covered stays, and Medicaid Home and Community- Based Services ( HCBS) waiver programs. Participants Dually eligible individuals who received Medicare skilled nursing facility ( SNF) or Medicaid NF services or HCBS waiver services in 2005. Interventions None. Measurements Potentially avoidable hospitalizations were defined by an expert panel that identified conditions and associated Diagnostic Related Groups ( DRGs) which can often be prevented or safely and effectively managed without hospitalization. Results More than one-third of the population was hospitalized at least once, totaling almost 1 million hospitalizations. The admitting DRG for 382,846 (39%) admissions were identified as PAH. PAH rates varied considerably among states, and blacks had a higher rate and costs for PAH than whites. Five conditions (pneumonia, congestive heart failure, urinary tract infections, dehydration, and chronic obstructive pulmonary disease/asthma) were responsible for 78% of the PAH. The total Medicare costs for these hospitalizations were $3 billion, but only $463 million for Medicaid. A sensitivity analysis, assuming that 20%-60% of these hospitalizations could be prevented, revealed that between 77,000 and 260,000 hospitalizations and between $625 million and $1.9 billion in expenditures could be avoided annually in this population. Conclusion Potentially avoidable hospitalizations are common and costly in the dually eligible population. New initiatives are needed to reduce PAH in this population as they are costly and can adversely affect function and quality of life.",2012,0,1,10.1111/j.1532-5415.2012.03920.x,http://www.systems.wsu.edu/scripts/wsuall.pl?url=https://search.ebscohost.com/login.aspx?direct=true&db=ccm&AN=104568209&site=ehost-live
85,86,"Staff Views On The Resident Assessment Instrument, Rai/Mds, In Nursing Homes, And The Use Of The Cognitive Performance Scale, Cps, In Different Levels Of Care In Stockholm, Sweden.","hansebo,g","Multidimensional functional assessment is the basis of individualized care. It is especially important in the care of elderly, with the complexity of symptomatology and often with cognitive impairment present. An assessment instrument for elderly persons, used in this study, is the Resident Assessment Instrument/Minimum Data Set (RAI/MDS) and its incorporated MDS Cognitive Performance Scale (CPS). The purposes of the study were to demonstrate the cognitive performance in elderly persons in different levels of care by using the CPS and to elicit the views of staff on use of the RAI/MDS. Cognitive impairment was found in 1276 elderly persons in six levels of care studied, an important factor to consider when organizing care of elderly. An intervention study was carried out for 1 year in three nursing home wards, with training and supervision in implementation of the RAI/MDS including individualized and documented care. Part of a questionnaire was used to evaluate staff (n = 50) views on using the instrument. A majority of the staff thought that the RAI/MDS could contribute to the improvement of quality of care, documentation in nursing records, and in co-operation and engagement. Further research is necessary to elicit more knowledge on the usefulness and benefits of the instrument.",1998,0,1,10.1046/j.1365-2648.1998.00707.x,http://www.systems.wsu.edu/scripts/wsuall.pl?url=https://search.ebscohost.com/login.aspx?direct=true&db=ccm&AN=107293860&site=ehost-live
84,85,Empirical Testing Of A Longitudinal Model Derived From The Roy Adaptation Model.,"ducharme,f","This article presents the steps and results of the empirical testing of a theoretical longitudinal model, derived from Roy's nursing conceptual model, of the psychosocial determinants of adaptation in different target groups. The model was elaborated and empirically verified based on the integrated results of four longitudinal studies involving groups vulnerable to mental health problems. By means of structural equation analyses, the cross-sectional model was verified at two points in time. The results showed that the model was relatively stable over time. The model was also tested using longitudinal data. Results showed little consistency in the patterns of relationships across studies. The significant links that emerged from the analyses shed some fight on the complexity of the process of adaptation to different types of stressors. They underscore the importance for nursing practice to develop interventions aimed at certain variables: perceived stress, conflicts in the exchange of support, and passive and avoidance coping strategies. The results also highlight the importance of the relationship between perceived stress, passive/avoidance coping strategies and psychological distress.",1998,0,1,,http://www.systems.wsu.edu/scripts/wsuall.pl?url=https://search.ebscohost.com/login.aspx?direct=true&db=ccm&AN=107162181&site=ehost-live
82,83,Association Between Continuing Education And Job Satisfaction Of Nurses Employed In Long-Term Care Facilities.,"robertson,em","BACKGROUND: The purpose of this descriptive, correlational study was to investigate the relationship between continuing education and job satisfaction among RNs and licensed practical nurses (LPNs) employed in long-term care facilities. METHOD: Herzberg's Motivational-Hygiene Theory was used as a framework to guide the design of the study. The Professional Educational Activities Scale and the McCloskey/Mueller Satisfaction Scale were completed by 110 nurses employed in long-term care facilities. RESULTS: No difference was found between type of employment status (full-time versus part-time) on the level of professional educational activities. However, RNs participated in more continuing education activities than LPNs. Nurses who reported higher family incomes also had greater participation in educational activities. Registered nurses reported greater job satisfaction than LPNs. No significant difference was found between the degree of job satisfaction for Black and White nurses. The results of this study indicated nurses who participated in more continuing education activities scored higher on the job satisfaction scale. CONCLUSION: As the elderly population increases, a critical need exists for nurses to be knowledgeable about current research-based information, including the economic and psychosocial effects of illness in later life. To provide the most effective care for the elderly population, nurses in long-term care must be knowledgeable about the complexity and specific characteristics of chronic illnesses. Continuing education activities are an important way to access this information.",1999,0,1,,http://www.systems.wsu.edu/scripts/wsuall.pl?url=https://search.ebscohost.com/login.aspx?direct=true&db=ccm&AN=107077388&site=ehost-live
