,id,title,name,abstract,year,title_use,abstract_mentions_count,doi,url
114,115,"163 Rehabilitation To Nursing Home - The Waiting Period...67Th Annual & Scientific Meeting Of The Irish Gerontological Society, Innovation, Advances And Excellence In Ageing, 26–28 September 2019, Cork, Ireland.","salawu,adefunke","Background The average application processing time for the National Nursing Home Support Scheme (NHSS) has seen drastic improvement from 15 weeks in 2014 to 4 weeks in 20161. There is no available data of the duration of stay in rehabilitation beds after approval of NHSS application and reasons for delay in transition to nursing home. Aims (1) To examine average length of stay in rehabilitation before multidisciplinary team (MDT) decision is made for nursing home care. (2) To examine average length of stay in rehabilitation bed from the time of NHSS approval to discharge into nursing home. (3) To examine reasons for delay in discharge to nursing home after NHSS approval. Methods A retrospective chart review of patients discharged into nursing homes between January to June, 2018 from geriatric rehabilitation units. Data collected include age, length of stay in rehabilitation unit before multidisciplinary decision was made in conjunction with patients/family to seek nursing home care (LOS1), Length of stay in rehabilitation bed following decision for nursing home care (LOS 2). Reasons for the delay in the transition from rehabilitation bed to nursing home bed were also documented. Results Seventeen patients were discharged into nursing homes, LOS1 of 43.12 days and LOS2 of 50 days. Complexity of application in terms of financial evaluation especially for patients who were deemed cognitively incapable of managing their finances, lack of suitable nursing homes for patients with complex needs/challenging behaviours, family dynamics with regards to choice of nursing homes and medical stability to facilitate such transfers were reasons for delay in transition to nursing home beds. Conclusion Transitional care beds, which are generally acknowledged to be more appropriate to these patients' care needs and are less expensive than rehabilitation beds, need to be utilized more. Education of healthy adults over 65 years to proactively plan for future care needs and promote awareness of legislatures regarding capacity and decision making.",2019,0,2,10.1093/ageing/afz103.96,http://www.systems.wsu.edu/scripts/wsuall.pl?url=https://search.ebscohost.com/login.aspx?direct=true&db=ccm&AN=138865082&site=ehost-live
116,117,Health Promotion For Mild Frailty Based On Behaviour Change: Perceptions Of Older People And Service Providers.,"avgerinou,christina","Mild frailty is common among older people, but it is potentially reversible with health promotion interventions. Behaviour change may be a key to preventing progression of frailty; however, we know little about what interventions work best and how a behaviour change approach would be perceived by this group. The aim of this study was to explore how mildly frail older people perceive health promotion based on behaviour change and what factors affect engagement with this approach. We conducted semi‐structured interviews with 16 older people with mild frailty who received a pilot home‐based behaviour change health promotion service, including a dyad of older person/family carer, and two service providers delivering the service in two diverse areas of South England. Interviews were audio‐recorded, transcribed and thematically analysed. The concept of goal setting was acceptable to most participants, though the process of goal setting needed time and consideration. Goals on maintaining independence, monitoring of progress and receiving feedback were reported to increase motivation. Physical/mental capability and knowledge/perception of own needs were main determinants of the type of goals chosen by participants as well as the approach used by the project workers. Older people with complex needs benefited from care coordination, with a combination of goal setting and elements of social, practical and emotional support in varying proportions. Mildly frail older people responded well to a behaviour change approach to promote health and well‐being. Further consideration is needed of the most effective strategies based on complexity of needs, and how to overcome barriers among people with cognitive impairment.",2019,0,2,10.1111/hsc.12781,http://www.systems.wsu.edu/scripts/wsuall.pl?url=https://search.ebscohost.com/login.aspx?direct=true&db=ccm&AN=138203873&site=ehost-live
128,129,Living With Dementia In Correctional Settings: A Case Report.,"peacock,shelley","The prison population is aging at an alarming rate and many older persons have the potential to develop dementia while in prison. This case report aims to explore the needs of older people living with dementia in prison and discusses the interventions that exist to address these needs. As the condition progresses, persons with dementia become increasingly reliant on the support of others for their health and well-being because of the increasing complexity of physical healthcare and psychosocial needs. Very few interventions are cited in the research literature regarding the use, acceptability, and/or effectiveness of programming for people living with dementia in prison. To support the unique and complex needs of these persons, research is needed to guide the development of evidence-informed dementia programs and services as well as consideration of interdisciplinary collaboration with community organizations.",2018,0,2,10.1097/JFN.0000000000000194,http://www.systems.wsu.edu/scripts/wsuall.pl?url=https://search.ebscohost.com/login.aspx?direct=true&db=ccm&AN=131544353&site=ehost-live
136,137,Healthcare Assistants And Aged Residential Care: A Challenging Policy And Contractual Environment.,"burrow,marla","Healthcare assistants provide the majority of direct care to the residents living in aged residential care. In New Zealand, the delivery of care is under the supervision of the registered nurse. The purpose of this article is to examine the New Zealand policy landscape and care demands in aged residential care. Within the current care environments, registered nurses are challenged by the responsibility of ensuring quality care delivered under supervision by healthcare assistants in an increasingly complex and contract driven environment. The complexity and acuity of a client population requiring specialised care challenges the constraints of care contract expectations and creates significant difficulties for both registered nurses and healthcare assistants. Variability in role identification and scope is a significant barrier to understanding the healthcare assistant workforce as a whole. Individual employment contracts between the employers and healthcare assistants promote further variability with differing role and certification requirements for hourly rates of pay. National contracts used by District Health Boards do not address the acuity creep that is occurring at all levels in aged residential care and the workload increases that directly impact registered nurse supervision of care. The overall funding of aged residential care is caught between a client population predominately funded by the State and the sweeping economic reforms that depend on privatization. Registered nurses need to have an understanding of the socio-political, economic and educational factors that influence care delivery in aged residential care.",2017,0,2,10.36951/ngpxnz.2017.006,http://www.systems.wsu.edu/scripts/wsuall.pl?url=https://search.ebscohost.com/login.aspx?direct=true&db=ccm&AN=133009010&site=ehost-live
118,119,Patient‐Centred Care Training Needs Of Health Care Assistants Who Provide Care For People With Dementia.,"foster,susan","It is well documented that Health care assistants (HCAs) provide the most hands‐on care to residents in aged care facilities, and play a critical role in the provision of care to dementia residents. Over the last 25 years, a philosophy of person‐centred care has become the preferred approach to care and this has meant that HCAs are encouraged to get to know the resident very well. This paper reports the experiences of HCAs in caring for people at end‐of‐life, identifies the skills required for their work and examines the education provided against these skills. Semi‐structured interviews were conducted in 49 facilities (n = 34) across New Zealand and data analysed thematically, with the aim of critically examining the adequacy of education for health care assistants which meets their needs within a person‐centred environment. The results confirm that the skills include traditional tasks of care (showering, feeding, toileting, and dressing) but the increasingly important communication and de‐escalation skills, both verbal and non‐verbal, have become central to their care skills. Education provided has not sufficiently shifted focus to include these more complex skills. Provision of educations that acknowledges the increased complexities of their role needs to be provided. As well, facilities need to be challenged to reconsider the HCA's position in the facility care tem.",2019,0,2,10.1111/hsc.12709,http://www.systems.wsu.edu/scripts/wsuall.pl?url=https://search.ebscohost.com/login.aspx?direct=true&db=ccm&AN=137037226&site=ehost-live
119,120,Specialist And Family Physician Collaboration: Insights From Primary Care‐Based Memory Clinics.,"lee,linda","Given limited available geriatric specialists and complexity of dementia care, there is a need for greater collaboration between primary care and specialists to better meet the needs of persons with dementia. Meaningful family physician—specialist collaboration has the potential to improve health outcomes, timely access to care and more appropriate healthcare resource utilisation. Primary Care Collaborative Memory Clinics (PCCMCs), which include specialist support, provide a significant opportunity for studying the family physician–specialist interface. This study aimed to explore the nature of collaborative relationships between memory clinic family physicians and specialists caring for persons with memory concerns in PCCMCs across Ontario, Canada. Family physicians (N = 71) attending an education session and specialists (N = 21) completed a survey in the fall of 2017 that measured frequency and amount of collaboration, perceptions of their relationship and identified factors that enable and challenge collaboration. Descriptive statistics were generated for quantitative data and themes for responses to open‐ended questions were explored using descriptive qualitative content analysis. Specialists and memory clinic family physicians valued their collaboration particularly as related to capacity building for dementia care and desired more time devoted to collaboration. Identified enablers and barriers to collaboration have implications for further integration of specialist support to potentially support improved patient care and further build capacity in primary care to manage dementia care. Opportunities exist for expanding and more intentionally supporting how family physicians and specialists interact with the creation of more formalised processes to support optimal collaboration, including a clear delineation of roles, responsibilities and expectations, more formally planned and structured relationship building and monitoring, identifying and addressing unique barriers to collaboration and use of a variety of methods of communication. Study findings have implications for how specialists and family physicians communicate and collaborate in other programmes for complex chronic conditions.",2019,0,2,10.1111/hsc.12751,http://www.systems.wsu.edu/scripts/wsuall.pl?url=https://search.ebscohost.com/login.aspx?direct=true&db=ccm&AN=137037268&site=ehost-live
132,133,Nursing Home Physicians Discuss Caring For Elderly Residents: An Exploratory Study.,"banerjee,albert","RÉSUMÉ: Malgré la complexité croissante des soins en foyers de soins de longue durée, le rôle des médecins dans la prestation des soins aux résidents a été peu étudié. Cette étude exploratoire internationale visait à mieux comprendre les rôles des médecins, leurs responsabilités et leurs tâches, ainsi qu’à explorer les caractéristiques uniques de la pratique médicale dans les foyers de soins de longue durée. Des entrevues ont été menées avec 18 médecins. Ces médecins ont mentionné qu’ils contribuaient fortement à la qualité des soins pour les résidents, en clarifiant les objectifs des soins, en prenant des mesures pour réduire les hospitalisations et les prescriptions de médicaments non nécessaires, et en contribuant à la formation du personnel. Les pratiques en foyers de soins de longue durée impliquaient les médecins au centre de réseaux de relations qui assuraient non seulement une meilleure qualité des soins médicaux, mais aussi une satisfaction professionnelle chez les médecins. L’importance de ces relations est telle qu’elle permettait d’aller au-delà des démarcations traditionnelles entre le domaine médical et le domaine social, et mettait en évidence qu’une bonne pratique médicale implique de bonnes pratiques sociales. Considérant la nature exploratoire de l’étude, les auteurs recommandent que de futures recherches soient menées pour mieux comprendre les dimensions relationnelles associées à la pratique de la médecine en foyers de soins de longue durée. Despite the increasing complexity of nursing home care, the role of physicians caring for residents is largely unexplored. This international, exploratory study sought to learn about physicians’ roles, responsibilities, and tasks as well as investigate the unique qualities of medical practice in nursing homes. We conducted interviews with 18 physicians, who reported making important contributions to the quality of resident care, including clarifying the goals of care, working to reduce unnecessary medication and hospitalization, as well as contributing to staff education. Nursing home practice involved physicians in networks of relations that were instrumental to the quality of medical care and physicians’ job satisfaction. The importance of these relationships disrupts the oft-drawn boundary between the medical and the social, suggesting that good medical practice depends on good social practice. Reflecting the exploratory nature of the study, we recommend research to better understand and support the relational dimensions of nursing home medicine.",2018,0,2,10.1017/S0714980818000089,http://www.systems.wsu.edu/scripts/wsuall.pl?url=https://search.ebscohost.com/login.aspx?direct=true&db=ccm&AN=130854479&site=ehost-live
249,250,Competence Thresholds For The Use Of Inhalers In People With Dementia.,"allen,sc","METHODS: the ability to learn three inhaler techniques of increasing levels of complexity was studied in 50 normal and demented inhaler-naive elderly people (mean age 81 years) with stable 10-point mini-mental test scores (MTS). There were 10 subjects in each of the following groups: MTS 8-10 (non-demented), MTS 7 (borderline), MTS 6 (mild dementia), MTS 5 and MTS 4 (2 moderate dementia groups). The techniques were taught on one day and reassessed on the following day on consecutive days in ascending order of complexity. RESULTS: those with an MTS of 4 were unable to learn any of the techniques, while all the non-demented people could learn all three techniques. For the five-stage technique (standard metered dose inhaler) the 0% threshold (i.e. when none of the subjects was able to learn) was MTS 6, the 50% threshold (at least half but not all could learn) MTS 7 and the 100% threshold (all could learn) MTS 8. For the four-stage technique (inhaler with large spacer) the 0% threshold was MTS 5, the 50% threshold MTS 6 and the 100% threshold MTS 8. For the three-stage technique (inspiration-triggered inhaler) the 0% threshold was MTS 4, the 50% threshold MTS 5 and the 100% threshold MTS 7. CONCLUSIONS: MTS can be used to determine the likelihood of a mild or moderately demented patient being able to learn a multiple-stage inhaler technique.",1997,0,2,10.1093/ageing/26.2.83,http://www.systems.wsu.edu/scripts/wsuall.pl?url=https://search.ebscohost.com/login.aspx?direct=true&db=ccm&AN=107138910&site=ehost-live
1,2,A Survey Of Nurses Involved In Assessing The Eligibility Of Older People For Nhs Continuing Healthcare.,"lee,geraldine","Why you should read this article: • To gain insight into the complexity of NHS continuing healthcare (CHC) assessments • To reflect on what skills and knowledge are required for the optimal assessment of an older person's eligibility for CHC • To understand the training and development needs of nurses involved in CHC-associated work Background: Nurses in England play a prominent role in NHS continuing healthcare (CHC) assessments, but there are no overview data on their knowledge and educational needs. Aim: An online survey was conducted to identify the educational status and development needs of nurses involved in CHC assessments. Method: The survey was informed by a literature review and focus group discussions, and distributed via email to the members of the Royal College of Nursing older people's forum. Descriptive data analysis was undertaken. Results: Overall, respondents were confident about their ability to undertake CHC-associated work and manage each aspect of the CHC process. However, respondents were less confident about how to determine whether a primary health need exists based on the four main criteria – nature, complexity, intensity and unpredictability – of a person's health and social care needs. This was one of the respondents' priorities for training and development. Conclusion: The survey demonstrates the importance of face-to-face and multidisciplinary CHC training delivered locally. It also confirms the need for a standardised approach and more consistency in the CHC assessment process. A CHC competency framework would contribute to standardise the process and benefit all involved.",2020,0,2,10.7748/nop.2020.e1266,http://www.systems.wsu.edu/scripts/wsuall.pl?url=https://search.ebscohost.com/login.aspx?direct=true&db=ccm&AN=147159743&site=ehost-live
166,167,Working Together To Improve The Care Of Older People: A New Framework For Collaboration.,"zeitz,kathryn","Aim. This paper is a report of a study identifying the care issues experienced by older people in the acute setting that could be improved through a collaborative approach to action. Background. Actively involving consumers in the governance of healthcare organizations is viewed positively, although there is less agreement on how to do this. Co-operative inquiry is a useful approach to involve consumers and clinicians in structured dialogue about understanding and changing care, whereas traditional quality improvement methodologies are often singular in their dimensions of change. Method. Using a co-operative inquiry approach, five workshops were facilitated over a 4-month period in 2008 with four volunteer older people, four clinicians and three facilitators (n = 11). All participants were actively involved in generating ideas and actions using a range of facilitation techniques and data collection methods. Findings. There was increased awareness, understanding and acceptance of clinicians' and consumers' experiences and expectations of care. The complexity behind changing so-called simple care (providing warm drinks, appetizing food), which were the key concerns for consumers, relied on the active management and broader transformation of the system, including teamwork, communication processes and organizational and individual values and beliefs. Conclusion. Consumers and clinicians put different emphasis on perspectives related to improving care of older people in the acute hospital setting. The disconnect between what consumers viewed as 'simple' organizational behaviours to change and what the clinicians viewed as complex, led to a recognition that the approach to organizational change needs to be reconceptualized.",2011,0,2,10.1111/j.1365-2648.2010.05478.x,http://www.systems.wsu.edu/scripts/wsuall.pl?url=https://search.ebscohost.com/login.aspx?direct=true&db=ccm&AN=55742795&site=ehost-live
317,324,Care Transitions: Integrating Transition Theory And Complexity Science Concepts.,"geary,carol.r","Care transitions, defined as hospital discharge or movement from one health care setting to another, are currently a major concern of health care providers and policy makers. Extensive empirical research has been conducted on care transitions, but the theoretical foundations are rarely made explicit. We propose that integrating concepts on complex adaptive systems from complexity science with classic theory on transitions in nursing provides a powerful new lens through which to study care transitions and improve transition outcomes. We summarize concepts from both theoretical approaches, propose an expanded model of transitions, and apply the model to the transition from hospital to home.",2012,1,2,10.1097/ans.0b013e31826260a5,http://www.systems.wsu.edu/scripts/wsuall.pl?url=https://search.ebscohost.com/login.aspx?direct=true&db=ccm&AN=108146612&site=ehost-live
312,318,Complexity Of Management And Health Outcomes In A Prospective Cohort Study Of 573 Heart Failure Patients In Australia: Does More Equal Less?,"driscoll,andrea","Aims and objectives To compare the efficacy of chronic heart failure management programmes ( CHF- MPs) according to a scoring algorithm used to quantify the level of applied interventions-the Heart Failure Intervention Score ( HF- IS). Background The overall efficacy of heart failure programmes has been proven in several meta-analyses. However, the debate continues as to which components are essential in a heart failure programme to improve patient outcomes. Design Prospective cohort study of patients participating in heart failure programmes. Method Forty-eight of 62 (77%) programmes in Australia participating in a national register of CHF- MPs were evaluated using the HF- IS: derived from a summed and weighted score of each intervention applied by the CHF- MP (27 interventions overall). The CHF- MPs were prospectively categorised as relatively low ( HF- IS < 190 - n = 39 programmes & 407 patients) or high ( HF- IS ≥ 190 - n = 9 programmes & 166 patients) in complexity. Six-month morbidity and mortality rates in 573 consecutively recruited patients with systolic dysfunction and in New York Heart Association Class II- IV were prospectively examined. Results Patients exposed to CHF- MPs with a high HF- IS had a lower rate of unplanned, all-cause hospitalisation ( n = 24, 14% vs. n = 102, 25%) compared with CHF- MPs with a low HF- IS within six months. On an adjusted basis, CHF- MPs with a high HF- IS were associated with a reduced risk of unplanned hospitalisation and/or death within six months and remained event-free longer. Conclusion High complexity CHF- MPs applying more evidence-based interventions are associated with a higher event-free survival over six months. Relevance to clinical practice The HF- IS is an easy-to-use evidence-based tool to assist programme coordinators to improve the quality of their heart failure programme which may also improve patient outcomes.",2013,1,2,10.1111/jocn.12073,http://www.systems.wsu.edu/scripts/wsuall.pl?url=https://search.ebscohost.com/login.aspx?direct=true&db=ccm&AN=86864339&site=ehost-live
299,301,Muscle Synergies And Complexity Of Neuromuscular Control During Gait In Cerebral Palsy.,"steele,katherine.m","Aim: Individuals with cerebral palsy (CP) have impaired movement due to a brain injury near birth. Understanding how neuromuscular control is altered in CP can provide insight into pathological movement. We sought to determine if individuals with CP demonstrate reduced complexity of neuromuscular control during gait compared with unimpaired individuals and if changes in control are related to functional ability.Method: Muscle synergies during gait were retrospectively analyzed for 633 individuals (age range 3.9-70y): 549 with CP (hemiplegia, n=122; diplegia, n=266; triplegia, n=73; quadriplegia, n=88) and 84 unimpaired individuals. Synergies were calculated using non-negative matrix factorization from surface electromyography collected during previous clinical gait analyses. Synergy complexity during gait was compared with diagnosis subtype, functional ability, and clinical examination measures.Result: Fewer synergies were required to describe muscle activity during gait in individuals with CP compared with unimpaired individuals. Changes in synergies were related to functional impairment and clinical examination measures including selective motor control, strength, and spasticity.Interpretation: Individuals with CP use a simplified control strategy during gait compared with unimpaired individuals. These results were similar to synergies during walking among adult stroke survivors, suggesting similar neuromuscular control strategies between these clinical populations.",2015,1,2,10.1111/dmcn.12826,http://www.systems.wsu.edu/scripts/wsuall.pl?url=https://search.ebscohost.com/login.aspx?direct=true&db=ccm&AN=111281580&site=ehost-live
