NCBI_ID,Journal,Publishers,Country_of_Publication,Language,Description,eISSN,ISSN,Year_1st_Published,Journal_URL
101140527,International journal of mental health nursing,Blackwell Pub.,Australia,eng, Title from cover. Official journal of the Australian and New Zealand College of Mental Health Nurses Inc.,1447-0349,1445-8330,2002,http://onlinelibrary.wiley.com/journal/10.1111/(ISSN)1447-0349
101582422,International journal of nursing knowledge,Wiley,United States,eng, Print issues ceased with v. 23 (2012),2047-3095,2047-3087,2012,http://onlinelibrary.wiley.com/journal/10.1111/(ISSN)2047-3095/issues
9613615,International journal of nursing practice,Wiley,Australia,eng," Title from cover. Print issues ceased with v. 18, no. 6 (2012). Vol. 1 complete in one issue.",1440-172X,1322-7114,1995,http://onlinelibrary.wiley.com/journal/10.1111/(ISSN)1440-172X
101155367,International journal of nursing terminologies and classifications : the official journal of NANDA International,Wiley Periodicals,United States,eng, Title from cover.,1744-618X,1541-5147,2002,http://onlinelibrary.wiley.com/journal/10.1111/(ISSN)1744-618X
9506762,International journal of palliative nursing,MA Healthcare,England,eng, Title from cover. Print issues ceased with v. 26 (2020).,2052-286X,1357-6321,1995,http://www.magonlinelibrary.com/toc/ijpn/current
9508871,The international journal of psychiatric nursing research,"Psychiatric Nursing Research Unit, University of Southampton, Nursing Studies, Southampton General Hospital",England,eng," Description based on: Vol. 1, issue 2 (Jan. 1995); title from cover. Latest issue consulted: Vol. 14, issue 1 (Oct. 2008) (viewed Mar. 24, 2009). Print issues ceased with v.13, no.1 (2007).",,0968-0624,1994,
9506955,International journal of trauma nursing,"Mosby-Year Book, Inc.",United States,eng," Title from cover. Issued by: Emergency Nurses Association, <-July/Sept. 2002>",,1075-4210,1995,
0323464,Irish nurses' journal,Spicer,Ireland,eng, Official journal of the Irish Nurses' Organisation.,,0021-1346,1968,
0323465,Irish nursing and hospital world,,Ireland,eng,,,0790-7702,1931,
17710360R,The Irish nursing news,Irish Guild of Catholic Nurses,Ireland,eng," Vol. numbering irregular: issues for 1922?-1950? numbered v. 1-27; for 1950?-1958, v. 1-8. No numbering used 1959- Official organ of the Irish Guild of Catholic Nurses.",,0021-1354,1922,
8505238,Issues (National Council of State Boards of Nursing (U.S.)),National Council of State Boards of Nursing,United States,eng, Title from caption.,,0885-0046,1980,
7702326,Issues in comprehensive pediatric nursing,Informa Healthcare,England,eng," Issues for May/June-Nov./Dec. 1976 have no vol. numbering but constitute vol. 1, no. 1-4. Supplements Comprehensive pediatric nursing.",1521-043X,0146-0862,1976,http://www.tandfonline.com/loi/icpn20
7908143,Issues in health care of women,"Hemisphere Pub. Corp., etc.]",United States,eng, Published to provide a means for continuing the nurse's education.,,0161-5246,1978,
7907126,Issues in mental health nursing,Informa Healthcare,England,eng, Imprint varies. Supplements and updates: Comprehensive psychiatric nursing.,1096-4673,0161-2840,1978,http://www.tandfonline.com/loi/imhn20
0203020,The Jamaican nurse,Nurses Association Of Jamaica,Jamaica,eng," Official organ of the Jamaica General Trained Nurses' Association, 1961?-April, 1966; of the Nurses' Association of Jamaica, August, 1966-",,0021-4140,1961,
9318900,The Johns Hopkins Nurses' alumni magazine,"Johns Hopkins Nurses Alumni Association, Inc.",United States,eng, Title from cover.,,,1987,
100888423,"JONA'S healthcare law, ethics and regulation",Lippincott Williams & Wilkins,United States,eng, Title from cover.,1539-073X,1520-9229,1999,http://ovidsp.ovid.com/ovidweb.cgi?T=JS&NEWS=n&CSC=Y&PAGE=toc&D=yrovft&AN=00128488-000000000-00000
17810330R,Jordemodern,Svenska Barnmorskeforbundets Tidskrift,Sweden,swe, Part of title on microfilm. Issued by Svenska barnmorskeförbundet.,,0021-7468,1888,
9500811,Jordmorbladet : bilag til tidsskriftet Sykepleien,Norsk Sykepleierforbund,Norway,nor," Description based on: 1994, nr. 2; title from cover. Supplement to: Journalen sykepleien, and: Sykepleien. Fag, 1994-1995; to: Tidsskriftet sykepleien, Oct. 1995- .",,0805-0562,1994,
17810430R,Josanpu zasshi = The Japanese journal for midwife,Igaku Shoin,Japan,jpn,,,0047-1836,1952,
9013563,Le Journal CANNT = CANNT journal : the journal of the Canadian Association of Nephrology Nurses and Technicians,Pappin Communications,Canada,eng, Title from cover. Articles in English with some also in French.,,1483-698X,1990,
101603887,Journal for nurses in professional development,Lippincott Williams & Wilkins,United States,eng," ""Influencing the learning and practice environments.""",2169-981X,2169-9798,2013,http://gateway.ovid.com/ovidweb.cgi?T=JS&MODE=ovid&NEWS=n&PAGE=toc&D=ovft&AN=01709760-201301000-00001
9809908,Journal for nurses in staff development : JNSD : official journal of the National Nursing Staff Development Organization,Lippincott Williams & Wilkins,United States,eng, Title from cover. Official journal of the NNSDO.,1538-9049,1098-7886,1998,http://ovidsp.ovid.com/ovidweb.cgi?T=JS&NEWS=n&CSC=Y&PAGE=toc&D=yrovft&AN=00124645-000000000-00000
8901657,Journal of advanced medical-surgical nursing,Aspen Publishers,United States,eng," ""An Aspen publication"". Title from cover. Each issue has also a distinctive title.",,0897-2869,1988,
9301156,Journal of case management,Springer Pub. Co.,United States,eng," Quarterly. Title from cover. A publication of the Case Management Institute of Connecticut Community Care, Inc. Merged with: Journal of long term home health care, to form: Care management journals.",,1061-3706,1992,
8812165,Journal of child and adolescent psychiatric and mental health nursing,Nursecom Publication,United States,eng, Title from cover.,,0897-9685,1988,
9431738,"Journal of child and adolescent psychiatric nursing : official publication of the Association of Child and Adolescent Psychiatric Nurses, Inc",Wiley,England,eng, Title from cover. Print issues ceased with 2013.,1744-6171,1073-6077,1994,http://onlinelibrary.wiley.com/journal/10.1111/(ISSN)1744-6171
9892302,Journal of child and family nursing,Lippincott Williams & Wilkins,United States,eng, Title from cover.,,1098-7134,1998,
9806360,Journal of child health care : for professionals working with children in the hospital and community,Sage Publications,England,eng, Title from cover. Official journal of the Association of British Paediatric Nurses.,1741-2889,1367-4935,1997,http://chc.sagepub.com/archive/
8411743,Journal of Christian nursing : a quarterly publication of Nurses Christian Fellowship,Nurses Christian Fellowship,United States,eng," Title from cover. Vol. 1, no. 1 also called: Premier issue.",,0743-2550,1984,http://ovidsp.ovid.com/ovidweb.cgi?T=JS&NEWS=n&CSC=Y&PAGE=toc&D=ovft&AN=00005217-000000000-00000
9207302,Journal of clinical nursing,Blackwell Scientific Publications,England,eng," Title from cover. Vols. for 2004-<2005> include separately paged issues with title: International journal of older people nursing, later published separately. Vols.for Mar. 2007- includes separately paged issues with title: Journal of nursing and healthcare of chronic illness.",1365-2702,0962-1067,1992,http://onlinelibrary.wiley.com/journal/10.1111/(ISSN)1365-2702
0262321,Journal of continuing education in nursing,"Charles B. Slack, inc.",United States,eng,,1938-2472,0022-0124,1970,http://www.healio.com/journals/jcen
9439196,Journal of cultural diversity,Tucker Publications,United States,eng, Title from cover. Issue for winter 1994 also called inaugural issue.,,1071-5568,1994,
7605913,Journal of emergency nursing,Mosby-Year Book,United States,eng," Bimonthly. Title from cover. Published: St. Louis, Mo. : C.V. Mosby, 1987?- . Issues for Jan./Feb.-Mar./Apr. 1975 have no vol. numbering but constitute v. 1, no. 1-2. Official publication of the Emergency Nurses Association, 1985?- .",1527-2966,0099-1767,1975,http://www.sciencedirect.com/science/journal/00991767
8003806,Journal of enterostomal therapy,Assn. Management Center],United States,eng," Cover title varies: Enterostomal therapy, May/June 1983. Official publication of the International Association for Enterostomal Therapy.",,0270-1170,1980,
9109128,"Journal of ET nursing : official publication, International Association for Enterostomal Therapy",Mosby-Year Book,United States,eng," Bimonthly. Title from cover. Official publication of the International Association for Enterostomal Therapy, 1991-July/Aug. 1992; of the Wound, Ostomy, and Continence Nurses Society, Sept. /Oct. 1992-1993.",,1055-3045,1991,
101659451,Journal of family health,Pavilion Publishing and Media Ltd,England,eng, Some issues have supplements.,,2058-7554,2015,
101142028,The journal of family health care,Pavilion Publishing and Media Ltd,England,eng," Title from cover. Unnumbered special supplement called: Family health care bulletin, accompany some issues.",,1474-9114,2002,
7510258,Journal of gerontological nursing,C. Slack.,United States,eng, Vols. for Feb. 1992-   have subtitle: For nursing care of older adults,,0098-9134,1975,http://www.healio.com/journals/jgn
8506709,Journal of holistic nursing : official journal of the American Holistic Nurses' Association,Sage Publications,United States,eng," Title from cover. Place of publication varies. Vol. 1, no. 1 called also: Founding issue.",1552-5724,0898-0101,1983,https://journals.sagepub.com/home/jhn
8709498,Journal of human lactation : official journal of International Lactation Consultant Association,Sage Publications,United States,eng," Description based on: Vol. 2, no. 2 (Sept. 1986); title from cover. Place of publication varies. Supplements accompany some vols.",1552-5732,0890-3344,1985,https://journals.sagepub.com/home/jhl
101124170,Journal of infusion nursing : the official publication of the Infusion Nurses Society,Lippincott Williams & Wilkins,United States,eng, Title from cover.,1539-0667,1533-1458,2001,http://ovidsp.ovid.com/ovidweb.cgi?T=JS&NEWS=n&CSC=Y&PAGE=toc&D=yrovft&AN=00129804-000000000-00000
8804311,Journal of intravenous nursing : the official publication of the Intravenous Nurses Society,Lippincott Williams & Wilkins,United States,eng, Title from cover.,,0896-5846,1988,http://ovidsp.ovid.com/ovidweb.cgi?T=JS&NEWS=n&CSC=Y&PAGE=toc&D=yrovft&AN=00005160-000000000-00000
8502669,Journal of nephrology nursing,Phoenix Educational Systems,United States,eng, Title from cover.,,0748-5328,1984,
7806870,The Journal of nursing care,"Health Science Division, Technomic Pub. Co",United States,eng, Official publication of the National Federation of Licensed Practical Nurses. Continues Nursing care.,,0162-7155,1978,
9875515,Journal Of Nursing Ethics,National Center For Nursing Ethics,United States,eng,,,,1978,
8605835,Journal of nursing history : a publication of the Nursing Archives Associates at Boston University,Trustees of Boston University,United States,eng, Title from cover.,,0888-5796,1985,
9306050,Journal of nursing management,Blackwell Scientific Publications,England,eng, Bimonthly. Title from cover.,1365-2834,0966-0429,1993,http://onlinelibrary.wiley.com/journal/10.1111/(ISSN)1365-2834
8703781,Journal of nursing quality assurance,Aspen Publishers,United States,eng," Title from cover. ""An Aspen publication."" Continued by: Journal of nursing care quality.",,0889-4647,1986,
8601288,Journal of nursing staff development : JNSD,Lippincott,United States,eng, Title from cover.,,0882-0627,1985,http://ovidsp.ovid.com/ovidweb.cgi?T=JS&NEWS=n&CSC=Y&PAGE=toc&D=yrovft&AN=00005108-000000000-00000
8219658,Journal of ophthalmic nursing & technology,"Charles B. Slack, Inc.",United States,eng," Title from cover. Vol. 18, no. 3 (May/June 1999) misnumbered as v. 19, no. 3.",,0744-7132,1982,
8709735,Journal of pediatric health care : official publication of National Association of Pediatric Nurse Associates & Practitioners,Mosby,United States,eng, Title from cover.,1532-656X,0891-5245,1987,http://www.sciencedirect.com/science/journal/08915245
8712414,Journal of pediatric & perinatal nutrition,Haworth Press,United States,eng, Title from cover.,,8756-6206,1987,
9610507,Journal of perianesthesia nursing : official journal of the American Society of PeriAnesthesia Nurses,W.B. Saunders Company,United States,eng, Title from cover.,1532-8473,1089-9472,1996,http://www.sciencedirect.com/science/journal/10899472
8801387,The Journal of perinatal & neonatal nursing,Lippincott Williams & Wilkins,United States,eng," Title from cover. Place of publication varies. Each issue has also a distinctive title. ""An Aspen publication.""",1550-5073,0893-2190,1987,http://ovidsp.ovid.com/ovidweb.cgi?T=JS&NEWS=n&CSC=Y&PAGE=toc&D=yrovft&AN=00005237-000000000-00000
101271023,Journal of perioperative practice,Sage in association with the Association for Perioperative Practice,England,eng," Description based on: Vol. 16, issue 2 (Feb. 2006); title from cover.",2515-7949,1750-4589,2006,http://journals.sagepub.com/home/ppj
8301364,The Journal of plastic and reconstructive surgical nursing : official organ of the American Society of Plastic and Reconstructive Surgical Nurses,American Society of Plastic and Reconstructive Surgical Nurses,United States,eng, Title from cover. Preceded by Nov. 1980 issue called also Special Issue and 12/80.,,0273-3285,1981,
8609069,Journal of post anesthesia nursing,Grune & Stratton,United States,eng, Title from cover. Official journal of: the American Society of Post Anesthesia Nurses.,,0883-9433,1986,
0376610,The Journal of practical nursing,National Association for Practical Nurse Education and Service,United States,eng, Official publication of the National Association for Practical Nurse Education and Service.,,0022-3867,1963,
9439514,Journal of psychiatric and mental health nursing,Blackwell Scientific Publications,England,eng, Title from cover.,1365-2850,1351-0126,1994,http://onlinelibrary.wiley.com/journal/10.1111/(ISSN)1365-2850
7900452,Journal of psychiatric nursing,Stuart James Pub. Co. [etc.],United States,eng,,,0277-2973,1963,
101392167,Journal of renal care,Wiley-Blackwell,United States,eng," Imprint varies. Description based on: Journal 32, nr.4 (Oct./Dec. 2006) ; title from cover. Latest issue consulted: Journal 33, nr.2 (Apr./June 2007) Also published online  in Dutch, French, German, Italian, and Spanish eds. and in print for 2006 only.",1755-6686,1755-6678,2006,http://onlinelibrary.wiley.com/journal/10.1111/(ISSN)1755-6686
9206498,The Journal of school nursing : the official publication of the National Association of School Nurses,Sage Publications,United States,eng, Imprint varies. Title from cover. Continues: School nurse.,1546-8364,1059-8405,1991,https://journals.sagepub.com/home/jsn
8916634,Journal of the American Academy of Nurse Practitioners,Slack for the American Academy of Nurse Practitioners,United States,eng, Title from cover.,1745-7599,1041-2972,1989,http://onlinelibrary.wiley.com/journal/10.1111/(ISSN)1745-7599
7601746,The Journal of the American Association of Nephrology Nurses & Technicians,American Association Of Nephrology Nurses And Technicians,United States,eng, At head of title: AANNT. Official publication of the American Association of Nephrology Nurses and Technicians.,,0360-7615,1974,
0431453,The Journal of the American Association of Nurse Anesthetists,American Association Of Nurse Anesthetists,United States,eng,,,0002-7448,1945,
101600770,Journal of the American Association of Nurse Practitioners,Wolters Kluwer,United States,eng, Print issues ceased with v. 26 (2014).,2327-6924,2327-6886,2013,http://ovidsp.ovid.com/ovidweb.cgi?T=JS&NEWS=n&CSC=Y&PAGE=toc&D=yrovft&AN=01741002-000000000-00000
8410048,Journal of the Association of Pediatric Oncology Nurses,The Association,United States,eng, Title from cover.,,0748-1802,1984,
9880621,Journal of the Catholic Nurses Guild of England and Wales,Catholic Nurses Guild of England and Wales,England,eng,,,,19uu,
7507218,The Journal of the New York State Nurses' Association,New York State Nurses Association,United States,eng,,,0028-7644,1970,
7901144,The Journal of the New York State School Nurse Teachers Association,New York State School Nurse Teachers Assn.],United States,eng, Official publication of the New York State School Nurse Teachers Association.,,0191-3751,1977,
7609158,Journal of the New York State School Nurse-Teachers Association,New York State School Nurse-Teachers Assn.,United States,eng, Title varies slightly. Official publication of the New York State School Nurse-Teachers Association.,,0036-1755,1969,
8204894,The Journal of the Operating Room Research Institute : JORRI,Operating Room Research Institute,United States,eng, Title from cover.,,0276-6353,1980,
18030020R,Journal of the West Australian Nurses,,Australia,eng, Official organ of the Western Australian Branch of the Royal Australian Nursing Federation.,,0022-5177,1935,
9306822,Journal of tissue viability,Tissue Viability Society,England,eng," Description based on: Vol 2, no 1 (Jan. 1992); title from cover. Continues: Care (Salisbury, England).",,0965-206X,1991,http://www.sciencedirect.com/science/journal/0965206X
9001407,Journal of transcultural nursing : official journal of the Transcultural Nursing Society,Sage Publications,United States,eng," Title from cover. Imprint varies: Livonia, Mich. : Madonna University, College of Nursing and Health, <summer 1992-> ; Sage Publications, <1999->",1552-7832,1043-6596,1989,https://journals.sagepub.com/home/tcn
9111439,Journal of transplant coordination : official publication of the North American Transplant Coordinators Organization (NATCO),Innovision Communications For The North American Transplant Coordinators Organization (Natco),United States,eng, Place of publication varies; title from cover.,,0905-9199,1991,
9512997,Journal of trauma nursing : the official journal of the Society of Trauma Nurses,Nursecom,United States,eng, Title from cover.,,1078-7496,1994,http://ovidsp.ovid.com/ovidweb.cgi?T=JS&NEWS=n&CSC=Y&PAGE=toc&D=yrovft&AN=00043860-000000000-00000
9014475,Journal of vascular nursing : official publication of the Society for Peripheral Vascular Nursing,Society For Peripheral Vascular Nursing,United States,eng, Title from cover. Continues: SPVN.,1532-6578,1062-0303,1990,http://www.sciencedirect.com/science/journal/10620303
9417080,Journal of wound care,MA Healthcare,England,eng," Description based on: Vol. 2, no. 3 (May 1993); title from cover.",,0969-0700,1992,http://www.magonlinelibrary.com/loi/jowc
9435679,"Journal of wound, ostomy, and continence nursing : official publication of The Wound, Ostomy and Continence Nurses Society",Mosby-Year Book,United States,eng, Title from cover.,1528-3976,1071-5754,1994,http://ovidsp.ovid.com/ovidweb.cgi?T=JS&NEWS=n&CSC=Y&PAGE=toc&D=yrovft&AN=00152192-000000000-00000
9008978,Journalen sykepleien,Norske Sykepleierforbund,Norway,nor," Title from cover. Organ of: Norsk sykepleierforbund. Merged with: Sykepleien. Fag, to become: Tidsskriftet sykepleien.",,0802-9776,1989,
18110565R,[Kango gijutsu] : [Nursing technique],Mejikaru Furendosha,Japan,jpn," Issues for Oct. 1956-    have also English title: The Japanese journal of nursing technics. Issues for v. 10, no. 1 1964 to v. 24, no. 2 1976 and v. 24, no. 3 1976 have also English title: The Japanese journal of nursing art. Both 1956 and 1958 called Vol. 4.",,0449-752X,1953,
18110540R,[Kango] Japanese journal of nursing,Japan Nursing Association,Japan,jpn," Issues for 1949-50 have title also in English: Nursing; 1951-58, in Japanese only. Issued 1949-shichigatsu 1951 by Nippon Josampu Kangofu Hokenfu Kyōkai; hachigatsu 1951-    by Nippon Kango Kyōkai.",,0022-8362,1949,
0133626,Kango kenkyu. The Japanese journal of nursing research,Igaku Shoin.,Japan,jpn,,,0022-8370,1968,
1305441,Kango kyoshitsu. [Nursing classroom],Igaku Shoin,Japan,jpn, Issues for Sept. 1957-Mar. 1964 have title also in English: The Japanese journal of the nursing class.,,0451-3347,1957,
18110570R,[Kango kyōiku] Japanese journal of nurses' education,Igaku Shoin,Japan,mul,,,0047-1895,1960,
7810064,Kango tenbō. The Japanese journal of nursing science,Mejikaru Furendosha.,Japan,jpn,,,0385-549X,1976,
18110590R,Kangogaku zasshi,,Japan,mul,,1345-2746,0386-9830,1946,
7601750,Kanho Hakhoe chi [The Journal of Nurses Academic Society],Taehan Kanho Hakhoe.,Korea (South),eng, Caption title also in English: The Journal of Nurses Academic Society. Table of contents and summaries in English.  Occasional article in English with Korean summary.,,0378-004X,1970,
9500886,Kanhohak t'amgu,"Yŏnse Taehakkyo Kanho Taehak, Kanho Chŏngchaek Yŏn'guso",Korea (South),eng," Each issue has also a distinctive title. Description based on: Che 2-kwŏn 1-ho, published 1993-yŏn. Articles chiefly in Korean with some in English; table of contents and summaries in both languages.",,1225-8466,1992,
18110790R,The Kansas nurse,Kansas State Nurses Association,United States,eng, Print issues ceased v. 83 (2008)? Issued by the Kansas State Nurses' Association.,,0022-8710,1941,
0153272,Kätilölehti,Suomen Katiloliitto,Finland,fin," Official journal of Suomen Kätilöliitto, 19",,0022-9415,1896,
8309653,Kentucky nurse,Published by APL Inc. for the Kentucky Nurses' Association,United States,eng, Title from cover. Official publication of the Kentucky Nurses Association. Continues: Kentucky Nurses Association.  Newsletter.,,0742-8367,1983,
0371210,Kenya nursing journal,National Nurses Association of Kenya,Kenya,eng," Issues for <2001?> called <[new series], vol. 1, no. 1->",,0301-0333,1972,
8305989,Kinderkrankenschwester : Organ der Sektion Kinderkrankenpflege,Schmidt-Romhild,Germany,ger, Title from cover.,,0723-2276,1982,
9425346,Klinisk sygepleje,Munksgaard International Publishers,Denmark,dan, Description based on: 1 (febr. 1988); title from cover.,,0902-2767,1987,
0321505,"Krankenpflege (Frankfurt am Main, Germany)",Deutscher Berufsverband Fur Krankenpflege,Germany,ger," Title from cover. Issued by: Agnes Karll-Verband für Krankenpflegeberufe, 1972-June 1973; Deutscher Berufsverband für Krankenpflege; July 1973-July/Aug. 1991; Deutscher Berufsverband für Pflegeberufe, Sept. 1991-1993.",,0944-9183,1972,
8006304,Krankenpflege Journal,Schwestern-Revue],Germany,ger,,,0174-108X,1980,
8000153,Krankenpflege. Soins infirmiers,Schweizer Berufsverband Der Krankenschwestern Und Krankenpflege,Switzerland,fre, Text in German or French. Organ of the Schweizer Berufsverband der Krankenschwestern und Krankenpfleger. Continues Zeitschrift für Krankenpflege.  Revue suisse des infirmières.,,0253-0465,1979,
0425135,Die Krankenschwester,Vereingung Der Diplom. Krankenschwestern Und Krankenpfleger Osterreichs,Austria,ger, Organ of the Vereinigung der Diplomierten Krankenschwestern und Krankenpfleger Oesterreichs. Continued by Oesterreichische Schwesternzeitung.,,0303-500X,1948,
8609082,"Kritiek (Ravels, Belgium)",Vlaamse Vereniging Intensieve Zorgen Verpleegkundigen,Belgium,dut," Description based on: Jaarg. 4, nr. 1 (okt.-nov. 1985); title from cover. Journal of the Vlaamse Vereniging Intensieve Zorgen Verpleegkundigen V.Z.W.",,0774-5346,1982,
8302118,Kurinikaru sutadī = Clinical study,Mejikaru Furendosha.,Japan,jpn," Description based on: dai 1-kan, dai 6-gō (9 '80); title from cover.",,0388-5585,1980,
0015376,The Lamp,New South Wales Nurses Association,Australia,eng, Official journal of the New South Wales Nurses' Association.,,0047-3936,1944,
8511320,Lampada,Royal College of Nursing,England,eng, Description based on: Issue no. 4 (summer 1985); title from cover. Magazine for all members of the Royal College of Nursing.,,0266-8769,1984,
8711105,Laser nursing,Mary Ann Liebert,United States,eng, Title from cover.,,0888-6075,1987,
8205794,"Law, medicine & health care : a publication of the American Society of Law & Medicine",American Society Of Law And Medicine,United States,eng," Title from cover. Issued winter 1992 by the American Society of Law, Medicine & Ethics. Formed by the union of: Medicolegal news, and: Nursing law & ethics and continues the numbering of the former.",,0277-8459,1981,
7507243,League exchange,National League For Nursing,United States,eng, Issued 1952 by the National League of Nursing Education; 1953-    by the National League for Nursing.  Some numbers issued by the Division of Nursing Education of the National League for Nursing.,,0077-5134,1952,
0102673,League lines,New York State League For Nursing,United States,eng,,,,1955,
9715780,The Lippincott health promotion letter,Lippincott-Raven Publishers,United States,eng, Title from caption.,,1089-9693,1997,
100961551,Lippincott's case management : managing the process of patient care,Lippincott Williams & Wilkins,United States,eng, Title from cover. Approved for continuing education credit.,,1529-7764,2000,http://ovidsp.ovid.com/ovidweb.cgi?T=JS&NEWS=n&CSC=Y&PAGE=toc&D=yrovft&AN=00129234-000000000-00000
9706704,Lippincott's primary care practice,Lippincott Williams & Wilkins,United States,eng," Title from cover. ""A peer-reviewed series."" Each issue has also a distinctive topic. Approved for continuing education credit.",,1088-5471,1997,
8608499,Long-term care quarterly,"American Nurses Association, Center For Research",United States,eng,,,0891-8104,1986,
1300152,Maine nurse,Maine State Nurses Association,United States,eng, Official bulletin of the Maine State Nurses' Association.,,0025-0767,1969,
9310753,MainLines : the newsletter for the Midwest Alliance in Nursing,MAIN,United States,eng," Description based on: Vol. 3, no. 3 (spring 1982); title from caption. Official publication of the Midwest Alliance in Nursing, fall 1992?- .",,0278-9450,1980,
