NCBI_ID,Journal,Publishers,Country_of_Publication,Language,Description,eISSN,ISSN,Year_1st_Published,Journal_URL
7502539,Chart,Illinois Nurses Association,United States,eng," Print ceased in 2007, online only 2008-2009.  Print resumed in 2010. ""For nurses"", 1986- Official publication of the Illinois State Nurses' Association. Continues the ISNA.",,0069-2778,1956,
7605561,Chot mai hēt kān phayābān,Samākom Phayābān hāeng Prathēt Thai.,Thailand,eng, Articles mainly in Thai with some in English; some summaries in English.,,0125-0035,1952,
0047107,Christian nurse,Christians Nurses League Of Cmai,India,eng, Publication of the Christian Nurses' League of C. M. A. I. No more published? Continues Nursing news.,,0009-5540,1965,
9882984,Christian nurse international,Nurses Christian Fellowship International,England,eng,,,1010-7355,1985,
100883848,CIN plus,Lippincott Williams & Wilkins,United States,eng, Title from caption.,,1098-7126,1998,http://ovidsp.ovid.com/ovidweb.cgi?T=JS&NEWS=n&CSC=Y&PAGE=toc&D=yrovft&AN=00128682-000000000-00000
9816180,Clinical excellence for nurse practitioners : the international journal of NPACE,Churchill Livingstone,United States,eng," Title from cover. Published <1998-> at Philadelphia, PA.",,1085-2360,1997,
9705336,Clinical journal of oncology nursing,Oncology Nursing Press,United States,eng, Title from cover. Issued by: Oncology Nursing Society.,1538-067X,1092-1095,1997,https://cjon.ons.org/archive
8709115,Clinical nurse specialist CNS,Lippincott Williams & Wilkins,United States,eng, Title from cover.,1538-9782,0887-6274,1987,http://ovidsp.ovid.com/ovidweb.cgi?T=JS&NEWS=n&CSC=Y&PAGE=toc&D=yrovft&AN=00002800-000000000-00000
9433629,Clinical nursing practice in epilepsy,Churchill Communications North America,United States,eng," Description based on: Vol. 1, issue 4 (Dec. 1993); title from cover.",,,1993,
9208508,Clinical nursing research,Sage Periodicals Press,United States,eng, Title from cover.,1552-3799,1054-7738,1992,http://cnr.sagepub.com/archive/
1250251,CNA bulletin,California Nurses' Assn.,United States,eng, Official publication of the California Nurses' Association.,,,1961,
9612493,"Collegian (Royal College of Nursing, Australia)",Elsevier Australia,Australia,eng, Title from cover. Vol. 1 complete in 1 issue.,1876-7575,1322-7696,1994,
16320400R,Colorado nurse,Colorado Nurses Association,United States,eng," Vol. numbers irregular: omitted: v. 53, no. 4-10; v. 54, no. 1-3; v. 58-v. 59, no. 5. Official publication of the Colorado State Nurses' Association, 1947?    -Nov. 1955; of the Colorado Nurses' Association, Dec. 1955-1984. Continued by Colorado nurse update.",,0010-1680,19uu,
8502809,Colorado nurse (1985),Colorado Nurses Association,United States,eng," Title from caption. Issues for Mar. 11, 1985-   called also: Vol. 85, no. 5- Continues: Colorado nurse update.",,8750-846X,1985,
7707277,Communicating nursing research,Western Interstate Commission for Higher Education.,United States,eng, Issued 1975-    as a journal of the Western Council on Higher Education for Nursing. Editor: v. [1]-    M. V. Batey Consists of papers presented at a conference sponsored 1968-73 by the Western Council on Higher Education for Nursing; 1974-    by the Western Society for Research in Nursing. Some issues contain the proceedings of the WIN Assembly. Vol. for 1968 has no vol. numbering but constitutes v. 1; vols. for 1969-74 have vol. numbering on spine only.,,0160-1652,1968,
9878931,Communique Newsletter,Wisconsin League For Nursing,United States,eng,,,,1977,
9879661,"Communiqué (Milwaukee, Wis.)",Wisconsin League for Nursing,United States,eng, Description based on: Winter 1981; title from cover. Official publication of the Wisconsin League for Nursing.,,0887-4557,1979,
9508559,Community nurse,Emap Healthcare,England,eng, Title from cover. Issues for Feb. 1995-   have separately paged insert: Nurse prescriber.,,1351-1416,1995,
8506876,Community nursing,"A.J. Jannetti, Inc.",United States,eng," Description based on: Vol. 2, no. 1, published 1985; title from caption. Supported through an educational grant from McNeil Consumer Products Company.",,0898-4891,1984,
7900730,Community outlook,Macmillan Journals Ltd.,England,eng," Issued with Nursing times. Issues for Aug. 1977-Feb. 1978 bound with Nursing times v. 73, no. 32-v. 74, no. 6.",,0262-8759,1977,
9809060,Community practitioner : the journal of the Community Practitioners' & Health Visitors' Association,Community Practitioners And Health Visitors Association,England,eng, Title from cover.,,1462-2815,1998,
101225531,Complementary therapies in clinical practice,Elsevier,England,eng, Title from cover.,1873-6947,1744-3881,2005,http://www.sciencedirect.com/science/journal/17443881
9506953,Complementary therapies in nursing & midwifery,Churchill Livingstone,Scotland,eng, Title from cover.,,1353-6117,1995,http://www.sciencedirect.com/science/journal/13536117
101682864,Comprehensive child and adolescent nursing,Taylor & Francis Group,England,eng,,2469-4207,2469-4193,2016,http://www.tandfonline.com/loi/icpn20
9214659,"Concern (Regina, Sask.)",Saskatchewan Registered Nurses Association,Canada,eng," Bimonthly. Description based on: Vol. 16, no. 4 (Aug. 1987); title from caption.",,0836-7310,1987,
9011101,Confederation of Australian Critical Care Nurses journal,Confederation Of The Australian Critical Care Nurses,Australia,eng," Quarterly. Description based on : Vol. 2, no. 3 (Sept. 1989); title from cover. Offical publication of the Clinical Nurse Specialists Association of Australia and New Zealand and the Australian Society of Critical Care Nurses, 1989?-   ; the Confederation of Australian Critical Care Nurses, 19  -1991. Formed by the union of: PULSE (Australian Society of Critical Care Nurses, and: CNSA journal. Continued by: Australian critical care.",,1033-3355,1988,
9878914,"Connecticut nursing news (Meriden, Conn. : 1980)",Connecticut Nurses' Association,United States,eng," Description based on: Vol. 54, issue 11 (Aug. 1981); title from caption. Latest issue consulted: Vol. 75, issue 3 (Sept., Oct., Nov. 2002). Print issues ceased with v. 82, no. 4 (Dec./Feb. 2009/2010) Official publication of the Connecticut Nurses' Association, <2002->",,0278-4092,1980,http://www.ctnurses.org/displaynewsletter.cfm
9211867,Contemporary nurse,Taylor & Francis,United States,eng," Two issues, 1992; 5 issues, 1992/1993- . Title from cover.",1839-3535,1037-6178,1992,http://www.tandfonline.com/loi/rcnj20
9505022,Creative nursing,"Creative Nursing Management, Inc.",United States,eng," Description based on: Vol. 1, issue 3 (Jan./Feb. 1995); title from cover.",,1078-4535,1994,http://connect.springerpub.com/content/sgrcn
8207799,Critical care nurse,American Association of Critical-Care Nurses,United States,eng, Title from cover.,1940-8250,0279-5442,1980,https://aacnjournals.org/ccnonline
8912620,Critical care nursing clinics of North America,Elsevier Health Sciences Division,United States,eng, Issues have distinctive titles.,1558-3481,0899-5885,1989,http://www.sciencedirect.com/science/journal/08995885
8704517,Critical care nursing quarterly,Lippincott Williams & Wilkins,United States,eng," Title from cover. Place of publication varies. ""An Aspen publication."" Vol. 25, no. 4 (2002) never published. Continues: CCQ.  Critical care quarterly.",1550-5111,0887-9303,1987,http://ovidsp.ovid.com/ovidweb.cgi?T=JS&NEWS=n&CSC=Y&PAGE=toc&D=yrovft&AN=00002727-000000000-00000
7802334,Critical care update,National Critical Care Institute Of Education,United States,eng, Official publication of the National Critical Care Institute of Education.,,0162-7252,1974,
9109511,CRNA : the clinical forum for nurse anesthetists,W.B. Saunders,United States,eng, Quarterly. Title from cover. Each issue with distinctive title. CRNA is Certified Registered Nurse Anesthetists.,,1048-2687,1990,
7901092,Curationis,AOSIS Publishing,South Africa,afr," Print issues ceased with v. 33, no. 3 (2010). Vol. 33 no. 4 (2010) not published. Articles in Afrikaans or English.",2223-6279,0379-8577,1978,http://www.curationis.org.za/index.php/curationis/issue/archive
9878284,Current practice in gerontological nursing,Mosby.,United States,eng," Editors: 1979-     A. M. Reinhardt, M. D. Quinn.",,,1979,
7606119,Current practice in obstetric and gynecologic nursing,C V Mosby Co,United States,eng, Editors: v. 1-    L. K. McNall and J. T. Galeener.,,0361-9249,1976,
7606120,Current practice in pediatric nursing,C V Mosby Co,United States,eng," Editors: v. 1-    P. A. Brandt, P. L. Chinn, and M. E. Smith.",,0361-9257,1976,
9879285,Deans List,Anthony J Jannetti,United States,eng,,,,1980,
9880408,Deans Notes,Anthony J Jannetti,United States,eng,,,,1984,
8901610,Decubitus,S-N Publications,United States,eng, Title from cover.,,0898-1655,1988,
0110777,Delaware nurse,Delaware Nurses Association,United States,eng, Vol. numbers irregular. Issued 1943?-57 by the Delaware State Nurses' Association.,,,1943,
9011113,Dermatology nursing,A.J. Jannetti,United States,eng," Bimonthly. Description based on: Vol. 2, no. 1 (Feb. 1990); title from cover. Print issues ceased with v. 21, no. 6 (Dec. 2009). Vol. 1 complete in one issue. Official journal of: the Dermatology Nurses' Association.",,1060-3441,1989,
0323406,Deutsche Krankenpflegezeitschrift,Kohlhammer,Germany,ger, Special issues accompany some numbers.,,0012-074X,1971,
19730430R,Deutsches Zentralblatt für Krankenpflege,,Germany,ger," Continues Praxis der Psychiatrie, Neurologie und Grenzgebiete.",,0417-3678,1961,
7701401,The Diabetes educator,"Sage Publications,",United States,eng, Supplements accompany some issues. Official journal of the American Association of Diabetes Educators.,1554-6063,0145-7217,1975,http://tde.sagepub.com/
8607500,Dimensions in oncology nursing : journal of the Division of Nursing,"University of Texas System Cancer Center, M.D. Anderson Hospital and Tumor Institute",United States,eng, Title from cover.,,0885-6192,1985,
8211489,Dimensions of critical care nursing : DCCN,Lippincott Williams & Wilkins,United States,eng, Title from cover. Place of publication varies.,1538-8646,0730-4625,1982,http://ovidsp.ovid.com/ovidweb.cgi?T=JS&NEWS=n&CSC=Y&PAGE=toc&D=yrovft&AN=00003465-000000000-00000
9504684,"Director (Cincinnati, Ohio)",The Association,United States,eng," Description based on: Vol. 3, no. 1 (winter 1995); title from cover. Vol. 1 complete in 1 issue. Absorbed: Nurse in assisted living.",,1551-8418,1993,
101155781,Disaster management & response : DMR : an official publication of the Emergency Nurses Association,Mosby,United States,eng," Title from cover. Sept. 2002 also called: Premiere issue; online version of Sept. 2002 issue called also Vol. 0, no. 0.",1540-2495,1540-2487,2003,http://www.sciencedirect.com/science/journal/15402487
0366533,District nursing,Queens Institute Of District Nursing,England,eng, Official journal of the Queen's Institute of District Nursing. Supersedes Queen's nurses' magazine. Continued by the Queen's nursing journal.,,0012-4044,1958,
100955578,"Dynamics (Pembroke, Ont.)",Pappin Communications,Canada,eng, Title from cover.,,1497-3715,2000,
9805754,EDTNA/ERCA journal (English ed.),F-Twee Publishers,Belgium,eng," Description based on: Journal 22, nr. 1 (Jan.-Mar. 1996); title from cover. Also published in Dutch, French, German, Italian, and Spanish eds.",,1019-083X,1985,
9310629,Elderly care,Nursing Standards Publications,England,eng, Title from cover.,,1369-1856,1993,
9208913,Emergency nurse : the journal of the RCN Accident and Emergency Nursing Association,RCNi,England,eng," Twice a year. Title from cover. Carries vol. numbering of: Nursing standard, v. 6, no. 27-    .   Began its own vol. numbering with v. 1 in 1993?",2047-8984,1354-5752,1992,http://journals.rcni.com/journal/en
8509371,"Emphasis, nursing","Formal Communications Committee, Dept. of Nursing, Harbor-UCLA Medical Center",United States,eng," Title from cover. Official publication of: the Formal Communications Committee, Dept. of Nursing, Los Angeles County Harbor-UCLA Medical Center.",,0886-7143,1985,
7701824,Enfermeria,Colegio De Enfermeras De Chile,Chile,spa, Official organ of the Colegio de Enfermeras de Chile.,,0378-6285,1965,
101778566,Enfermería intensiva,[Elsevier España],,eng,,2529-9840,,2017,https://www.sciencedirect.com/journal/enfermeria-intensiva-english-ed
9517771,Enfermería intensiva,Elsevier España,Spain,spa," Imprint varies. Description based on: Vol. 6, 1 (enero-marzo 1995). Articles in Spanish; summaries in English and Spanish.",1578-1291,1130-2399,1988,http://www.sciencedirect.com/science/journal/11302399
9879302,Enfoque,Ethicon,Brazil,por,,,0101-3408,1974,
7506581,ENLB. Emergency nurse legal bulletin,MED/LAW Publishers.,United States,eng,,,0098-1516,1975,
0057376,Epheta; revista de enfermería y acción social,Conferencia De Superiores Mayores Religrosos Ce Colombia,Colombia,spa, Organ of the Liga Nacional Colombiana de Religiosas Enfermeras.,,0071-0970,1962,
0102642,Epione,Suomen Sairaanhoitajatajayhdistys,Finland,fin, Journal of Suomen Sairaanhoitajayhdistys. Text in Finnish or Swedish.,,,1908,
7906030,ET journal,International Association For Enterosomal Therapy,United States,eng, Official publication of the International Association for Enterostomal Therapy. Continued by Journal of enterostomal therapy.,,0195-9883,1974,
9879792,Etudes Sur Les Soins Et Le Service Infirmier,Association Des Amis De L Ecole Internationale D Enseignement Infirmier Superieur,France,fre,,,0338-3989,1975,
9301979,European journal of cancer care,Wiley,England,eng," Title from cover. Issued also in French, German, Italian, and Spanish. Print issues ceased with v. 21, no. 6 (2012).",1365-2354,0961-5423,1991,http://onlinelibrary.wiley.com/journal/10.1111/(ISSN)1365-2354
9433395,European Quality Assurance Network newsletter,Foundation Of Nursing Studies,England,eng," Description based on: No. 4 (Mar. 9, 1994); title from cover. Carries numbering of Nursing standards (Royal College of Nursing (Great Britain) : 1987), v. 8, no. 24?- . Produced by: Royal College of Nursing Dynamic Quality Improvement Programme and the Foundation of Nursing Studies in association with Nursing standard.",,,199u,
0366610,F.N.I.B.; organe de la Fédération nationale des infirmier(e)s belges,Federation Nationale Des Infirmier(e)s Belges,Belgium,fre, Called also N. V. B. V.; tijdschrift van het Nationaal Verbond van Belgische Verple(e)g(st)ers.,,0301-0813,1972,
9008896,Fag tidsskriftet sykepleien,Norsk Sykepleierforbund,Norway,nor, Title from cover. Some issues with: Aids info. Continues in part: Sykepleien. Continued by: Sykepleien.  Fag.,,0802-9768,1989,
16930040R,Felʹdsher i akusherka,Medgiz,Russia (Federation),rus," Table of contents in Russian and English, 1958- Published by Narodnyĭ komissariat zdravookhraneniia SSSR, 1940-45; by Ministerstvo zdravookhraneniia SSSR and Ministerstvo zdravookhraneniia RSFSR, 1946- Merged with: Medit︠s︡inskai︠a︡ sestra, to form: Medit︠s︡inskai︠a︡ pomoshchʹ.",,0014-9772,1940,
9880024,Flash-Informations,Federation Nationale Des Infirmier(e)s Belges,Belgium,eng,,,0771-8187,1983,
16930510R,The Florida nurse,Florida State Nurses Association,United States,eng, Official publication of the Florida State Nurses' Association Continues the Bulletin of the Florida State Nurse's Association.,,0015-4199,1955,
9002951,FNIB info,Fédération nationale neutre des infirmier(e)s de Belgique,Belgium,fre," Description based on: 1989, no 5 (sept.-oct. [1989]); title from cover. Bimonthly. In French.",,0774-935X,1987,
9879072,Focus On Aacn,American Association Of Critical Care Nurses,United States,eng,,,,1980,
8302805,Focus on critical care,C.V. Mosby Company,United States,eng, Title from cover. Official publication of the American Association of Critical-Care Nurses. Continues: Focus on AACN.,,0736-3605,1983,
7502563,Frontier Nursing Service quarterly bulletin,Frontier Nursing Service,United States,eng," One issue a year, June 1928-     called also Annual report - Frontier Nursing Service, 3d- Continues the Quarterly bulletin of the Kentucky Committee for Mothers and Babies.",,0016-2116,1928,
8915377,Gastroenterology nursing : the official journal of the Society of Gastroenterology Nurses and Associates,Lippincott Williams & Wilkins,United States,eng, Title from cover. Place of publication varies. Continues: SGA journal (Society of Gastrointestinal Assistants (U.S.)).,1538-9766,1042-895X,1989,http://ovidsp.ovid.com/ovidweb.cgi?T=JS&NEWS=n&CSC=Y&PAGE=toc&D=yrovft&AN=00001610-000000000-00000
7902818,The Gem State RN news letter,Idaho State Nurses Assn,United States,eng, Official publication of the Idaho State Nurses' Association. Continues The Gem State R. N. Superseded by RN Idaho.,,0072-0569,1964,
0047220,Georgia nursing,Georgia State Nurses Association,United States,eng," Vol. numbers irregular: v. 17 omitted (issue for winter 1960/61 called v. 17, no. 4, but constitutes v. 16, no. 4) Official publication of the Georgia State Nurses Association.",,0016-8335,1945,
8510067,"Geriatric nursing (London, England)",Baillière Tindall    -c1986.,England,eng," Description based on: Vol. 5, no. 1 (Jan. 1985); title from cover.",,0950-0448,1981,
0046433,Geriatric nursing,Miller Publishing Company,United States,eng,,,0435-5733,1965,
8309633,"Geriatric nursing (New York, N.Y.)",Mosby-Yearbook,United States,eng, Title from cover. Place of publication varies.,1528-3984,0197-4572,1980,http://www.sciencedirect.com/science/journal/01974572
8701774,Geriatric nursing and home care,Baillière Tindall,England,eng, Title from cover.,,0269-9079,1986,
8608449,Gerontion,Gerontion,Canada,eng, Title from cover.,,0829-8297,1986,
0235326,The Ghanaian nurse,Ghana Registered Nurses Association,Ghana,eng, Official organ of the Ghana Registered Nurses' Association.,,,1961,
101135199,"Hawaii nurse (Honolulu, Hawaii : 1994)",The Association,United States,eng," Title from caption. ""Nursing news from the Hawaii Nurses' Association."" Continues publication with the same title.",,1047-4749,1994,
8914865,The Hawaii nurse : the official monthly newsletter of the Hawaii Nurses' Association,Hawaii Nurses Association,United States,eng," Description based on: Vol. 30, no. 4 (May 1989); title from caption.",,,1989,
7701836,Hawaii nurses pipeline,Hawaii Nurses Association,United States,eng,,,0146-2784,1962,
9879426,Healing Light,"Holistic Assertive Nurse, Nonprofit Newsletter",United States,eng,,,,1981,
8411543,Health care for women international,Routledge,England,eng," Title from cover. Imprint varies. The journal of the International Council on Women's Health Issues, <1996->",1096-4665,0739-9332,1984,http://www.tandfonline.com/openurl?genre=journal&eissn=1096-4665
7512764,Health education,"American Alliance for Health Physical Education, Recreation and Dance",United States,eng, Place of publication varies.,,0097-0050,1975,
0366537,The Health of the people,S.N,New Zealand,eng," Formed by the merger of Occupational health New Zealand and Community health, and assumes the numbering of the former.",,0301-0384,1972,
17320470R,Health visitor,Health Visitors Association,England,eng," Official journal of the Health Visitors' Association; issued by Community Practitioners' and Health Visitors' Association,   -Feb. 1998.",,0017-9140,1964,
9104930,"Heartbeat (San Francisco, Calif.)",Henderson Communications,United States,eng," Description based on: Vol. 1, no. 3 (summer 1990); title from caption.",,1057-0438,1990,
0377562,Hellenis adelphe,Ethnikos Syndesmos Diplomatouchon Hellenidon Nosokomon,Greece,gre," Journal of the Ethnikos Syndesmos Diplomatouchon Hellenidon Nosokomon, and continues its Deltion. tion. English summary of contents inserted in each issue. Continued by: Nosēleutikē.",,0301-5157,1965,
9104138,Hoitotiede,Sairaanhoitajien Koulutussaatio,Finland,fin, Title from cover. Semiannual. Vol. 18 (2006) never published. Some articles have English abstracts. Issued by: Sairaanhoitajien koulutussäätiö. Continues: Sairaanhoidon vuosikirja.,,0786-5686,1989,
17410240R,[Hokenfu zasshi] The Japanese journal for public health nurse,Igaku Shoin,Japan,jpn,,,0047-1844,1951,
9879074,Holistic Assertive Nurse,"Holistic Assertive Nurse, Nonprofit Newsletter",United States,eng,,,,1981,
8702105,Holistic nursing practice,Lippincott Williams & Wilkins,United States,eng," Title from cover. Place of publication varies. ""An Aspen publication."" Only 5 issued published in 2002. Continues: Topics in clinical nursing.",1550-5138,0887-9311,1986,http://ovidsp.ovid.com/ovidweb.cgi?T=JS&NEWS=n&CSC=Y&PAGE=toc&D=yrovft&AN=00004650-000000000-00000
9809996,Home care manager,Lippincott-Raven Publishers,United States,eng, Title from caption. Companion publication to: Home healthcare nurse.,,1094-0375,1997,
9605410,Home care provider,Mosby-Year Book,United States,eng, Title from cover.,,1084-628X,1996,
101650829,Home healthcare now,Lippincott Williams and Wilkins,United States,eng,,2374-4537,2374-4529,2015,http://ovidsp.ovid.com/ovidweb.cgi?T=JS&NEWS=n&CSC=Y&PAGE=toc&D=yrovft&AN=01845097-000000000-00000
8403379,Home healthcare nurse,Lippincott Williams & Wilkins,United States,eng," Title from cover. Official journal of the Home Healthcare Nurses Association, 1995?- Complemented by: Home care manager, <Sept./Oct. 1997-July/Aug. 1998>; Home healthcare nurse manager, <Sept./Oct. 1998->",1539-0713,0884-741X,1983,http://ovidsp.ovid.com/ovidweb.cgi?T=JS&NEWS=n&CSC=Y&PAGE=toc&D=yrovft&AN=00004045-000000000-00000
100884165,Home healthcare nurse manager,Lippincott Williams & Wilkins,United States,eng, Title from caption.,,1520-5657,1998,
8505218,The Hospice journal,Haworth Press,United States,eng," Title from cover. Place of publication varies. Official journal of the National Hospice Organization, <1987>-2001. Merged with: Journal of pharmaceutical care in pain & symptom control, to form: Journal of pain & palliative care pharmacotherapy.",,0742-969X,1985,
0435746,Image,Sigma Theta Tau National Honor Society Of Nursing,United States,eng," Official publication of Sigma Theta Tau, National Honor Society of Nursing.",,0363-2792,1967,
0163356,Imprint,National Student Nurses' Assn.,United States,eng," First issue each year is online only and titled ""Career Planning Guide"".",,0019-3062,1968,
17540290R,The Indiana nurse,Indiana State Nurses Association,United States,eng, Issued by the Indiana State Nurses' Association.,,0019-6681,1951,
8703508,Infection control Canada,Health Media Inc.,Canada,eng, Title from cover. Articles in English or French; summaries in both languages. Prepared by CHICA-Canada.,,0833-076X,1986,
7903304,Infection control & urological care,Travenol Laboratories,United States,eng, Sponsored May/June 1977-    by the Medical Products Division.,,0740-3615,1977,
0174016,L' Infirmiere haïtienne,Association Nationale Des Infirmieres Licenciees D Haiti,Haiti,fre,,,,1967,
7804334,Infirmiers,Societe Sopepharm,France,fre, Issued with the participation of nursing schools in various African republics.,,0180-2224,1977,
0366542,L' Infirmière,Federation Nationale Des Infirmier(e)s Belges,Belgium,fre, Called also De Verpleegster. Organ of the Fédération nationale des infirmier(e)s belges.,,0019-9591,1923,
8410629,L'Infirmière auxiliaire : revue de la Corporation professionnelle des infirmières et infirmiers auxiliaires du Québec,La Corporation,Canada,eng, Title from cover. Articles chiefly in French with some in English.,,0822-8558,1982,
0042116,L' Infirmière canadienne,Association Des Infirmieres Canadiennes,Canada,fre," Issues for juin 1959-déc. 1965 called v. 55, no. 6-v. 61, in continuation of the French portion of the Canadian nurse, but constitute 1.-7. année.",,0019-9605,1959,
9430795,L'Infirmière du Québec : revue officielle de l'Ordre des infirmières et infirmiers du Québec,L'Ordre des infirmières et infirmiers du Québec,Canada,fre, Title from cover.,,1195-2695,1993,
0400674,L'Infirmière francaise,Editions Lamarre Poinat,France,fre," Issues for 1923-1940? called annèe 1-18. Publication suspended 1941-45. Issued by the Association nationale des infirmières françaises diplômées d'état, 1929-July 1960.",,0019-9613,1923,
8807312,"Inforum (Adelaide, S. Aust.)","Nursing Department, Royal Adelaide Hospital",Australia,eng," Description based on: Vol. 7, July 1986; title from cover.",,0812-9304,1980,
9111431,Insight (American Society of Ophthalmic Registered Nurses),Mosby For The American Society Of Ophthalmic Registered Nurses,United States,eng," Place of publication varies. Description based on: Vol. 16, no. 3 (June 1991); title from cover. Print issues ceased with v. 42, no. 4 (2017). Official publication of: American Society of Ophthalmic Registered Nurses.",1532-6594,1060-135X,1976,
8507471,Intensive care nursing,Churchill Livingstone,Scotland,eng," Official journal of: British Association of Critical Care Nurses,   -1991.",,0266-612X,1985,http://www.sciencedirect.com/science/journal/0266612X
9211274,Intensive & critical care nursing,Elsevier,Netherlands,eng," Title from cover. 1992-1995: ""Official journal of the British Association of Critical Care Nurses.""",1532-4036,0964-3397,1992,http://www.sciencedirect.com/science/journal/09643397
101770518,Inter-University Faculty Work Conference,Regional Nursing Program,United States,eng,,,,1964,
9880227,Intercom,Iowa Nurses' Association.,United States,eng, Official publication of the Iowa Nurses's Association.,,0273-9127,19uu,
101472191,International emergency nursing,Elsevier,England,eng, Description based on first issue; title from cover.,1878-013X,1755-599X,2008,http://www.sciencedirect.com/science/journal/1755599X
9608372,International history of nursing journal : IHNJ,RCN pub. Co.,England,eng," Title from cover. Published by RCN Pub. Co., autumn 1995- . ""A Nursing standard publication.""",,1360-1105,1995,
